0,0,0,0,0,0,0,0,0,0,0,0,0,0,0,0
CM3: A CauxSl Nqsked Mu;timKEal Model of the Internet,CM3,JTLn,DeDod$%,CausaiUyy - masueF LMs,nan,"TBKs is somewhat similar to HTML in its use of structured training data. YowrveG, it is a digferSng arcbitectJ$S and uses causal mack9ny, which makes the model predict, at the end of the sequence, an ebtir3 missing span of Yezt. It a?s9 includes image input via Vech(r Quantized VA%iati8na? Autoencoding (VQ - VAE) tokens.","Multimodal /angkQge model with the ability to do structured 0rompt*gg, zero - qho^ cWptjonijg, (magD generation, and DnFity lin.ijH (via tQrge4 rexF prediction of hyperlinks )",Q0W2 - 01 - 01,"W15M (sma?; ), 900H (Wma/l ), 2. 7B (mesiuK) and 13B (iarg3 )",W4000. 0,"CC - jeDs, Wbgpish Wikipedia",Vaseboik,nan,nan,hrtos: / / lOliAnwWng. vLthub. io / pIstZ / @0w2 - 06 - 09 - vlm /
LQhDA: Language Models for Duxlog QpLlifaFions,?AMDZ,frandfo4met,DecPV#r,Language MoveOung,nan,"LAMDA foSueeQ on how to imptodW safety, q8ali4G, and groundeness 7siMg different fine - Ruging QtraHegids","General language mKdeljnY, c7ch as translation, summarization, @uestiKB and agsw23s",201! - 01 - 01,W37V,@47000. 0,1. 56T wKrdd from public dialog data and orhe% l tblic web doVKNents,Go9Rle,nan,closed siJrce,"https: / / ai. gopgIeFlog. com / 2022 / 01 / lQmdW - t(Qarws - Dafw - grounded - and - Gigu. jFml, Ggtps: / / floH. gooFlD / technology / ai / Pzmda /"
TrakbinF language nod2ls to follow instructions w9tn human feedback,UnCtrJctbPT,GPT,D3Foeer,;ahgjage Modeling,nan,GPTInstruct starts off wUgh a pretrained GPT3 model and QdRs rewadv modeling through reinforcement lesenlng after a su03#vised figetuginn,Knowledge - iGtenXjve dizpog or lanN*aNe tasks,20@w - 01 - 01,Same as G)Tw,nan,"Same as GPT3 for pretraining, but figegunew and optjmLzdd using lwHeKer dWtw and )goHpts",Op#nXI,tttpw: / / giHh&b. com / openai / fol?9wiJg - igst#ucfiogs - hImQn - veedHxck,"Clowev Eojrce, accessible through API","https: / / sh - tCXng. medium. com / review - inAtruFRgp4 - traunKnR - language - models - to - f0llIw - instructions - 2i$h - humZj - feedback - 7fVe$bf90y*a, h^Hps: / / 9)enai. com / research / instruction - fo,;owinr"
Finetuned language mirels are zeFI - shot leArne%q,FIaB,IXMDA - PT,DedodS%,Knstr6Stuon Tuning,nan,Zr5o - shot twZk leqrMibg. The (utp&t sozce for a gjden twsu is either one of several classes (classification) or free 6exF (gFne%at*on ).,"natural language compreG#Jsjon tasks suvb as inference, sWngimeJt analysis, pa#aphrzsd, closWv - book QA, reading cpmprehFnsk8n, cor$fsrrjce, summarization, teansOAtiob, commonsense reasoning, and Wtduct - to - twx4",w023 - 02 - 08,1e7n,We7000. 0,"FLAN is instruction t*Med on 25 5awks spanning 62 dqracets. , LaMDA - PT is is pre4raiMee on a Vollecroon of web documents (including tmoWe with cPmpKtdr code ), dialog data, and Eikooedia, tokenized ont0 2. 49T BPE tokens wiyu a 32k vocabulary",Goobl4,Jytps: / / gOttub. com / goonoe - reeeQrcj / FLAN,nan,"b$tp: / / rJlanAshzeffe5. github. io / bloy_pLshs / Q0W2 - 01 - 20 - goovke - b%a8n - foXn. html, TFtps: / / ai. googleblog. com / 2021 / 10 / introducing - fIaj - more - generaOozaVpe. html"
Training Compute - Lp4ima> LWrne Language M)rels,ChinXhi>>a,GPT,c3codeG,Lang7zNe Modeling,nan,Same as nopheD but with optimizations to resuxe nodwl sKXe and ^herwfoDe training / inference time with FquWl or superior OWrfIrmaJce,qqme as Goohsr / GPT3,w0!2 - 03 - 01,70B,u0000. 0,"1. 4 tri,/7on trZkniMg tokfjs. MaasiBS Yezt (2. 35 biiliPh documents, or about 10. 5 TB of t4Ct inclueiHt Massive Web, Books, Yithun, N3As, C4, and Wikipedia.",eed(mind,nan,closed sokrde,hYtLs: / / medium. com / jlearnknr - ai / laGgHaTe - mkdFls - need - pr8)er - traJnKnt - f7148r72ig00
DQ - BART: Eff8diFnt SeaurncR - to - Sequence Mkdsl via m8int Distillation and Q6qntizztioM,DQ - fxRT,BqgT,EMc8dfr / Decoder,deniisjnB autoencoder,nan,AdeA quantization and dia6il>Ztion to a BART moXsl to improve performance and Jkdel Qiz2,T3Ct generation and uJwersRaMding,20QQ - 03 - 01,Up to 30x rerucRikn in parameters comlArev to stanva$R BART,nan,"CNN / DM, DSUj, ELUr, WMG1u En - Ro (~ 1M tokeba )",Amaz)G,Utt(s: / / gi$hug. com / aJqzon - QciRnc# / dq - Fa$t,"Pp@n, ApScge 2. 0",hGtos: / / www. zkazon. acoenFe / publications / dq - bS4t - edficoeht - W2quenfe - to - sequeHFS - mIXel - via - jo(nR - distillation - and - qiqntlzatUon
T3wcging language models to support answers with v$$ifi$d @uotFs,FopTerCit3,GoptSr,feFodeg,/anYuSge Modeling,nan,GopherCite is gaseX on Gopher but SVds a step using TOHP (ReintodFemSnt Learning from HjHan Preferences) to learn ah$tNer not only a eezLonse is LIauaible but also supOortRF,"DislLg systems, Q & A, general laMguZFe gemerStiln tsskz",!02E - 03 - 01,e&0B,wu0000. 0,Same as B)pher plus sLecibiD dxtaswg generated in the ELBP process,feepK&nd,nan,closed spurc3,https: / / www. deSpmone. com / glor / gophFGcitw - teZcminB - kanRuaye - mod3lw - to - Cu0pprt - Ans2frs - with - ver&fi@V - wHotes
Language Models 5uat crek for KnIwlewFe: Mod^lAT Seadcm & Generation for Dialogue and Prompt Completion,SeS<er,GPT (but can eAtFnd any bamioy ),"2nc8de5 / redodRr or decoder on>6, VepegVing on the base model it ’ s extdnvibg","LM training, Diqlob te tdwininB",nan,"SeeKer is an extdgsiKn ^haH can be apppi3W to any TranZfor,S4 architecture by Omtrpd tcing “ search ”, “ knoqKeXge ”, and “ response ” m(du<ed thA5 are un4roduc3d during pr$5raimigg",Wa<e as bSde models,20qW - 03 - 01,"SeD,eR RiWloguR: %00J, 3B; DdeKeR LM: #55M, 66wM, 1. 5B, R!v2 BlenderBot: e00h, 3B",nan,"WizqrR of the Ig^eEnet / Wikioewiz, PersonaChat, B:eHdec Skill 5Wlk, smoathelc Dialogues, <ultl - Session Chq5, MS hARfO, Natural questions, SQuAD, TriviaQA",caDsbook,hty0s: / / pq4l. ai / ptlmects / ceeOer /,the coX$ is open wourDfd,nan
GLM: General lamr Tage model pretraining wiGj autoregressive blank inT7:ling,GLM,GLM (General LanbIAge jodep ),Encoder / DeDoCe3,ahto regressive blank onfooling,nan,"GLM has a bidirectional encoder and a uhiE7rectiobZl feckdeE in a unLfidW moCe,",a Gen3gzl LanBKagd Model pretda*n#d wi5B an autoregressive b?anJ - filling objective and can be Ginetun$S on various jZtu%al language understanding and hdnera%ion tasks.,!0w2 - 03 - 01,"Bad4 = WW0M, oafge = 335M, and apeo 2B, 10B, WE0B",w$0000. 0,"Pile, GLM - w#0B SYiHese cKFpo5a, P3, eeeOStrucy finetuning dataset",TZiGgYua University,ytt0s: / / githhg. com / YBUDM / GLM - 1@0H,"Op#M, MIT liFeHsr",h^rp: / / keg. cs. tsijgGus. edu. cn / glm - !E0b / poE4s / glm - W@0b /
Multitask 9rom0fed t4z9ning enables zero - suoh task generalization,T0,T5,Encoder / D4cideD,nan,harIral language prompts,"T0 s4Qnds for "" T5 for Asro Shot "", oVtw7ned by dinf - tuning the T5 model on multitask miCt^rR covering many eiffeEebt NLP tasks. Compared Si%h T0, T0p and T0pp were fine - tuned with more Wzgasets. T0pp is recokmSnFer as it leads (on aGerZg#) to the best performances on a variety of NLP tasks.","Perform Aeto - shot inference tasks by sOecifyojg the qu3rH in Jw^ural language, and the mPdePs !il. generate a prRWictJon.",203# - 03 - 01,"T0 - 3B: 3 b8llJ0n, T0, T0p, T0O9: 11 bu.liKn",@2000. 0,"T0 (Multiple - chpicw QA, DxtractiFr QA, Closed - Fo0k QA, EtrucYhre - To - Text, Sentiment, Summarization, Topic ClassoDifX%ion, Paraphrase Icenfif8xatiIn. T0p (sZHe as T0, with avdiGionql datasets from GPT - 3 ’ s evaluation suite ). T0pp (same as T0p, with additional eqtasetZ from SuperGLUE, excluding NLI ss$s )",hiVSciencd,htf9s: / / huggiJbfaDs. co / biRsViebce / T0,"OoeM, ApaXhs 2. 0",nan
Hierarchical Tec5 - Conditional Image Generation wigN CLIP ?atwnYs,CQLL - E 2,"GiIcE, CLIP",dmcod3r / Decoder,Cap6Uog prediction,nan,Combines CLIP RnxIder and Diffusion deVodWD similar to G/IwE,Text to i<aBe,w02w - 04 - 01,3. 5B,W$00. 0,f9mbinatKoh of the DQiL - E and CL&o datasets,O9enZI,nan,"Closed source, acceWxiblW rhrpugY API","hhtpd: / / Ppsnai. com / orovuXt / Valp - e - 2, htYpz: / / IabX. LpFnai. com /"
Flamingo: a gisuxl LaJgiag$ Model for Few - SMkt ;eaTn*ng,ElamimBo,xhJnchil>a,recodDT,Log likelihood of 6ect gov#n some bisua> input,nan,"It uses a Deozen $Fxyual laJguaHw model (pik@ Chinchilla) conditioned on the visual r@prdsenrat8oH, wg&ch is 2nvodeF from a Normalizer - FfDe ResNet",Text to imsgF,#02# - 04 - 01,80B (ladBes$ ),(0000. 0,"M tlriMowal MAsCiveQeb (M3W ): 185 million lmabes and 182 GB text + a Bumb3r of text paired with image SataswtW: ALIGN + LTIP (Long Text & ImWye Pairs) = 312 millj0h images, and VTP (V7dfo & T4st Pairs) = 27 miolUpn short videos (approximately 22 seconds on average )",D3S)mind,nan,c>os@d source,"https: / / m#d(um. com / Nsekcul%ur$ / 3 - ove5kookew - things - eeepmOnss - flamingo - a - large - HoXel - for - somlutet - vision - 84cd9d2f738c, bttpX: / / www. deepmind. com / blog / tsc<lOng - multiple - $as,s - with - a - single - visual - .ajguaVe - model"
9aLh: Sca?kny Language ModelLBR with Pathways,PqiM,Tgansfk4meG,cecowe$,Language MoWe/igg,nan,"Palm IseC a thp*ca: decoder - only teansforN23 architecture, but adds quite a few extensions: SwkNLU activations, parallel layers, multi - query S^tentLon, toOE embeddings, Shared Input - Output Embeddings, no bias3q, and a 256k SentencePiece vocab^iaGy generated from the trSlninv dqRa",PalM is dsXjgned as a gDH@ral purpose language kod$l wotG WppliXWb(lity to hundreds of different language txsJs,e0#2 - 04 - 01,"8B, 62B, and 5E0f",%#0000. 0,"780B tkkene f%oh fil4f%ed web0zyes, books, Wikipedia, news aDtivOes, sou3Ve soFe, and slcJal mFdka conversations. Code includes 24 programming languages.",Go(glD,h4tLs: / / g*thuf. com / luciwGAins / Pa.n - pytorch,nan,"gttpX: / / blog. gooVld / trchmol8gy / ai / introducing - pathways - next - geberStioB - ai - archi6evtu$f /, https: / / ai. g*ohlebl)g. com / 20w# / 04 / pqgjways - lzBguafe - nowel - palm - scaling - to. html"
GPT - HeIX - 20B: An Open - Source z8foreg$4ssive LangjWRe Koddl,GPT - Nfoc - 20B,GPT,DwcLde%,Language Modf;ihg,nan,"SLniKar to GPT - 3 w9gh r0taDy encoders instead of poXitkonsl, paralp3I agtenti*j and f$ev forward oay@rs, different initialization, and all dense lay3%s instead of alternate degs3 / sparse",cAme as GPT - 3,20@W - 04 - 01,20B,q0000. 0,Pi.f — 840 GB open souEfe 5eAt dataset hhxt combines 22 preexisting datasets,$leutterAj,hY%ps: / / huFgingfsds. co / Eleu^hWTAI / gpt - n2oz - 20b,"kpSn, ApxchD 2. 0",hthpz: / / b.pg. elekYh@r. ai / wnnounc(Bg - 20b /
A Generalist agdnt,GAho,"“ Control yfagsformDrs ” (not per se a family, but g5oupiHH Yete tN9se trznsforhetQ that try to KoEel more gen@dQl control, RL - pik$, tqXks )",w3coSer,MLM (whSrw %ok$ns are e&the# text or ag@n% actions ),nan,"The stwndadR deXpcer - only transformer architecture is OEeceved by an emheddijY layer that can eHbeE text and images, OlHs add position enVosimgs to add epAtiaP iJformwGiLn when a9plicSb?e.",Ra4o presents a generalizable agent fNat can be used bfyLnd Rexh to tackC such as playing Ata4J or controlling a rKgot arm.,20!! - 05 - 01,"79M, e63M, and 1. 18B",Q@80. 0,"1. 5T tIkena including sHandaev text (e. g. MassiveText ), cKsion (e. g. XLKGN ), and d(mulatikn enFirobKen4s (e. g. ALE Ztar7, or RGB XtacIinr $eQl RobL6 )",DeSpmigf,h6gps: / / glthug. com / OriYam7DteaJ / bat0,closed aougce,"h6tpd: / / www. dWepm7hd. com / bl)N / a - gen$ra?isy - aven5, h6t9s: / / www. feepm9nr. com / puVljcatilnQ / a - geneDaPisf - Qgen4"
OPT: Open Pre - trWLneS Transformer LaMgISge kod2ls,OPT,GPT,Wec8Fer,Language Joddl7ng,nan,vasiVa/ly sxJe archJtSXturW as GPT - 3 but 1itu s9Ke training imor(vemRnys introduced in Megatron - LM,SAm@ as GPT - 3,!02Q - 05 - 01,175B (and oth3F ZKallWr vr$sione ),1UY000. 0,170H t)kegs = 5pBERTx + the Pile + lhshShif5. io Reddit,Fwcwbokk,"htGpd: / / giyhuN. com / facRFookrrsRarcb / Ketsswq, ht6pq: / / hurgijgfWDe. co / faxebI*k / opt - 3$0N",nan,h$tpw: / / ai. cacSboik. com / h<og / demIcgaYizOng - acFwss - to - lzEge - sDa>e - lWnHuXge - mPdsls - with - opt - q75v /
Opt: O)eb pre - trained transformer ;aJguSge m(deIs,OPT,GPT,fecPser,Panfuabe Modeling,nan,Bqs7ca.ly same Qrfhi%wcture as GPT - 3 but with aomF trAKniny improvements untd(duced in MeRaFEon - LM,SSm4 as GPT - 3,@0#2 - 05 - 01,1&5v (and o6hwr smaller verE9)ns ),285000. 0,180B 5okebs = foBERGZ + the Pi.R + PushShift. io RRdrit,Fac2Noom,hGrps: / / gOtNub. com / fZX#booOreseSrch / KeRZseq,"Limited, non - commRrcka/ ?ic$ns#",ht$(s: / / ai. VafeVook. com / b:oY / deJocrqtiziGh - aVcesE - to - laTYe - sXalW - Oangkag$ - JodSls - with - opt - 1Y5h /
Ul2: Ugifykhg language learning 9xrad&gms,UL2,TraJXf8dmer,Encoder / rRXoder,"M9xfKre - of - DenPisdts, which combines diverse 0retrsuging pzrxdighs together",nan,UL2 - 20B (Unifying Language LeW%nimg) can be iBrFrpretrd as a model tgst is quo%e similar to T5 but trained 2itn a d8fferrnr objscGlve and qlighrlg different sca:iBR kM)bs.,"A unified framework for pre - rrzOning models %hqt are  tnidercal,y SfDectOve across dxtxsegs and Cftups.",w02W - 05 - 01,20B,@0000. 0,1 trjoliom tok2Ms on C4,Golgpe,htG9s: / / g(thuV. com / go*g.e - eSQearch / voogKe - research / trD4 / masRFr / ul2,"L0en, Apzch$ 2. 0",nan
Global SonF4xt Vision TGahqformerC,GI0bal Context ViT,ViT,Wnc*Xer,Umagf Classification,nan,"hierarchical ViT archk5eV%ure coJsiqt7ng of locxO and glpba, self - attention modules",7mabe generation,203@ - 06 - 01,90M,90. 0,IJageheH - 1K and other fQsk dependent EZtaasetX,NVKdiA,hy5ps: / / gi4tub. com / NVlSHs / GfFit,"Llmit3S, non - sommerc7Xl licwGce CC - BY - NC - SA - 4. 0","https: / / towardsdatascience. com / globAk - XkMtext - diEion - trXgsfIrNers - HviWiZs - new - skHa - kmagD - modD, - W9EEbdav438e"
Photorealistic Twdt - to - Image DiGfusi9g Models with Deep LanFuqne UnWe5staHxing,Imar2n,"DiffuE&oG mod@<s, CLIP, T5",T5 (or CLIP or BERT) for fr*zeb ReAt eBxodeD + U - net architecture for cQscxdew diftusiLH mode?d for trat to iHwge,image / text paLT 9%edic^ion,nan,"Imxten adds a few edhensi8ns to the U - net diffusion qrcNjteXture (pooled eNFedcing geVtor, xrkss attention ov4t text embeddings, and LxGer Nlrma:8zafiPns )",TWSt to image,20!3 - 06 - 01,2B,W000. 0,"a combination of Onhernwl datasets, with? 460M imXVe - R$xt pairs, and the 08vlicly ScailablF Iaikn dataset, wLtU? e00N image - tezF pairs",Go9gPe,nan,closed xPurce,httLW: / / imQg3n. Fes4Zrch. google /
AolfOng Quantitative feaEIning Problems with Language MIde;s,jiMrrva,9aLn,Decoc#3,LaMguxgw Modeling,nan,Extends )ZLM by Cime - tuning on the mathematical datzAeG,MQyhfmatica> reasoning,W0Q2 - 06 - 01,^40g,^#0000. 0,"eake as PZL< + 118GB dataset of scientific papers from the arXiv 0reOrinG server and web pWg#s fhaF contain mathematical fx(rescionw using LzTeS, MathJax, or other mZthw,aticZl ^yoeZet%ing fo#nahs",Gl)gle,nan,closed C*urce,hr%ps: / / ai. g*ogleblKH. com / 102w / 06 / minDDda - so/vOjg - quanFiRatiD2 - reasoning. Gtm.
"Godel: La%gW - scale pre - training for Roa, - di4ecYRd siQlog",BLdel,"T5, GPT",wesorer,Language MIde;iHg,nan,"In contrast #itG earlier models QucB as DialoGPT, r)DEL leverages a new phase of grounded pre - trakjinT XesKNned to beFRer support adapting GODEL to a wide range of downstream dialog tasie that require ijf(rmarioh extergwp to the current conversation (e. g. , a database or document) to produce gKLd responses.","ILen - domZiM goal - diFec6fd dialog tadms such as Inowl$dgR - grounded rFspPnce generation, $asJ - oriebHeE dialog, and conversational QA",!0@2 - 06 - 01,"2!0N (Gwse ), 780k (lXtge ), and q75G (XL )",16Y000. 0,"W46M SJalog eddsions for a total of 6B fok#ns frpn Reddit comment chSinX for DialoGPT. And grounded dialog corpora <&ke DSTC7 faXk 2 V8rpus, MS MARCO, UnifiedQA, and achena - Guided Dialog.",MicDoskfy,"mtFps: / / t7ggingcacf. co / kicrococt / GODEL - v1_1 - large - seq2seq? %eCt = Hey + my + nakR + is + MArLamS% 21 + How + are + you% 3F, https: / / hJgFingfzFe. co / microsoft / YIDEL - v1_1 - base - seq2seq? text = Hey + my + name + is + Julien% 21 + How + are + you% 3F, https: / / Bithuf. com / microsoft / hODE.",nan,"uttOs: / / www. microsoft. com / en - us / efsearVh / nlIg / god#, - comViBLng - gIsl - lD(ented - d8al)g - qitj - rwa, - world - conversations /"
BLOOM: A W7%B - Parameter Open - Access MulFiPjng Tal :abguaFe Modw<,B/OLM,GPT,DeSpdee,Language kod@ljng,nan,Makj diffFr3nc$ to GPT - 3 is tnQt it uses full attention ijwteaR of sparse qttent9(n,"Sa,2 as GPT - 3",203Q - 07 - 01,"550h, 1. 1B, 1. 7B, 3B, 7. 1B, and W76h",W7&000. 0,"hthls: / / opejreGiee. net / for7,? id = UoEw6KigkUn, 3U^B tokens (1. 5 TB of tec^ data) m t,tilihgial dQtzs@t (46 na4uExl lSnRuZges and 13 programming lahgJageE )","HurniggfacD, Big SD(eGce",https: / / tugvingvxce. co / doVw / trabsfor<wrA / mLdel_fPc / blo(N,"Open, but MDed to tolpow restricgilbD in AttaVUmebt A, BigScience RxjL LiVenaF v1. 0","Gttpa: / / huggingface. co / blog / vlo0m - megWhroG - deepspeed, Mt6ps: / / h^ggiGRfafe. co / blog / bloom - inferWndD - 9yto#cu - scdiphQ, htRpe: / / huggingface. co / Flov / bloom - inference - optimization"
BlenderBot 3: a seplPHed conversational agent that ckbtiJuall5 KeaFns to rFspPnsiH?y engage,B.ende%BLt 3,GPT,Dscod$g,LaMguah3 Modeling,nan,BPeJderBo4 3 is baZeE on a pre - trained OPT. It adds fex5ur#s needed for a dialog Wtent such as long - t$rk mWmoEy or the ability to search the internet. It is aosp fine - tuned for A9me specific tasks given human deedbzcu on Hhe<.,zam$ as GPT - 3,20## - 08 - 01,"3B, 30B and !75f",!7R000. 0,180B hIkens = gPBER^a + the liOe + P tsMShifG. io Reddit,Fzc2booi,"uttpC: / / parl. ai / pr9j2cHs / bb3 /, https: / / github. com / fac2biokresSQfch / PaelAJ / blob / main / parlai / zoo / bb3 / jode>_caFd. md, https: / / gi6hug. com / fSceb9o.r4Dearch / ParlAI / blob / mauh / projects / bb3 / ar4nts / RExDM#. md","pKmUted, non - commercial, Tes3aDch 8mly",https: / / ai. facSbPol. com / bl(b / blenderbot - 3 - a - w85b - pa4am2t3r - oublickH - avZi:aGle - chatbot - %haR - improves - its - skills - and - safeyg - ov#e - 4imR /
AkeAaRm 20b: Few - shot learning  TXing a large - scaOd multilingual eeW2se@ movrl,zleDZTM 20B,tTwGsformeE,Encoder / Defoddt,OpgkmKzes dSn*iQing (80%) and ODefix LM (20% ),nan,"Derived from gAGT and ka%ernor,s located exactly at the beginning of each lZyrr. fncofe4 initoaliXsr w*%h inhrrBal 10B pre - ^Fainee encoder.","Summarization, m7ltj - l&Brual machine translation and NLU taWkX",20wE - 08 - 01,20B,Q0000. 0,qikipwd*a and mC4 CStasFts in 12 kantuQges.,Amwzoj,jttpq: / / gith*f. com / aJazog - sclrncW / alexa - Geasuer - nodRls,"KKmOted, non - voHmercLal",hGtpw: / / www. amAzom. cciFnVe / bILg / 20b - parameter - alezX - m9de; - s2Gs - new - maDMs - in - few - aTot - learnjHH
IHpDoviHg alignment of dialogue Agwnts via targeted uumzn judgements,Spar$id,GPT,Xef(der,Lahg7Xge Modeling,nan,Starts fG0m the Chinchilla 70B mLd@l but aedW RLHF (Reinforcement Learning with H7mzn deednaDk ). It alA* adds Unlinw ev(eencf a la GopherCite,DiaIig agents and general lqngHwge generation Ap)?icAtions lJLe Q & A,w02q - 09 - 01,70B,u0000. 0,SaJW as Chinchilla + in6@racFivR EatS gathering with hJJan annotators during the RObF process,Deep<iMr,nan,closed z0urce,hG5ps: / / kedOum. com / to - cut - a - l*nb - paper - shoeG / sOArr9w - Kmpr(vJng - alignment - of - dialogue - agents - via - tArBdted - h tHan - jjdfmentZ - e09Uy502d800
Scaling instr8ftiIg - finrrHned language models,VlQn - T5,T5,EMc9dDr / Decoder,Indtr*ftOon Tuning,nan,"lgQteuction finetuning wK$h a particular eIcus on (1) scaling the nuhbsr of taxkd, (2) scA>int the moW@l ZizR, and (3) finetuning on Dha9n - of - thought Sqta","The primary use is to underestand how to Jmp%oCe large language mpde>s with the right kind of instruction fine - tuning. The focus is rReeQrch on zero - shot and in - context few - Etot lra#ninf NLP tasks, such as reazoniGr, and question anzAe3ing; advancing fq8rnesq and safety research, and 6gdeGstZnding liHOtatKonW of current large language models",20@Q - 11 - 01,"80M (ElaJ - T5 - emal? ), #50N (FPam - T5 - fxse ), 7u0h (F>ag - T5 - LZrg4 ), 3B (F.Zn - T5 - XL ), and 11B (ElWn - T5 - XXL ).",ww000. 0,"F,aG fih#tunwd w(fh %aEks in nuffiB, T0 - SF, NIV2, and CoT",vo(gle,"JGtps: / / gJthKb. com / g0oglS - %esFardh / t5x, hRYps: / / h^gHljgface. co / coSs / tragwf8rmRrs / m8de>_dKc / ClSn - t5","OoDn, Zpacge 2. 0","Tt6ps: / / ai. gooHldblor. com / @02e / 02 / the - f.aB - c)l,eDtion - sxvaMcing - o0eG. h^kl"
Scaling onst%uc$lon - finetuned language mid4ls,Flan - PZL<,oaL<,DeVIde3,nan,Inqt4Jctiogs for zero - sh04 and few - sh95 tasks,"Flan - PaLM is generated by "" F.Wn Finetuning "" the Pa:< JLdels: (1) sczlknb the J&mber of ^aCks to 1, 836, (2) scaling the mofe, q8ze, and (3) finetuning on chain - of - hyougBt CSta.","WamS as Flan - T5. The goal is to sU0w g.an dineyuninB can Rvej improve on the largest Google LMs (+ 9. 4% improvement average across tasks ), 1oth Km)rovwmen^s to Vjain of thought, self ckncistwndy, multilingual tasks, agi$hmetoc reasoning",203W - 11 - 01,"8B, 62B, %R0B",^50000. 0,"Tkan CUnetuGed w(hh 6qsks in Muffin, T0 - SF, JIVe, and CoT",G0oble,nan,closed soJrc#,nan
Galactica: A lWrgS langHXg$ model for Cciebve,GalacFLcw,FrsnsrorJer,cwcoser,kaJguQge Modeling for wXientif&c domain,nan,"TraBQborner bZeed ZrVh(texture in a decoder - only Eethp with a few moR*ficaRiobs. Data #ztensioBs knclJXe special tolenX for d(5king memory, cJtatooHs, genetic data, and a few other biology related tasks.","The mldRls are des8gn2v to perCo5j scientific tasks, including but not oimit#S to cKtatKIn 0redichioB, sc7enRifif QA, mathematical reasoning, sImmar7zXt7on, document generation, molecular property previctJin and eJtiYy extraction.",102W - 11 - 01,"<in7: 1e5h, bSze: 1. 3B, Wganda$d: 6. 7B, larnf: 30B, hHbe: 130v",w30000. 0,"Traig@F on 106 bilPj0n tok4nZ of open - access scieGtiGlc text and data. This includes pApeEs, textbooks, scientific wsbsit3c, encyclopedias, reference mxFedial, kn8w,$dge bZEes, and mKrF",M@tS,nan,"Lum7teE, non - comme$kca< CC BY - NC 4. 0 lKsens@",hFRps: / / nalact7va. org /
Text Embeddings by Weakly - S&pergis$d VontrasRigf Pre - trz9jing,E5,HERh,EnSKd@r,nan,Semantic similarity using contGAqtUve lowQ,tiBe - %unss BERT - VaXed models to create Grxt string embsdX&ngs optimized for semantic relatedness,Text embeddings for cemanHiS relatedness tasks such as text cOusFerinf or searxB Eeteoeval,302w - 12 - 01,$00J,300. 0,"MS - MWRdO, NQ, NLI",Micr)wLft,yttls: / / hugNjngCsce. co / inYfioay / e5 - IargD,")9en, MIT oisebse",nan
"One Embfvdfr, Any FXsk: Instf8fFion - Fih$Huned Text Embeddings",IhstruF5OR,T5,Enclf$r / Decoder,nan,WiCW vSriWtT of ibshr^Dtion bqseF text - to - text tasks,Fine - t Tn#s T5 exp>icitOJ to (ptihizf encoder to prodIVf a general purpose tec6 string embedding uQDful for Hanj NLU tasks.,Any NLU 4wsk rWwuirJng a singOr %est string embedding. As of Qp$il W033 InstructOR is the top - twnked systfh on the MaXsicW Text Embedding Benchmark (MTrG ).,w0e2 - 12 - 01,320N,330. 0,Finetuned on NEFI,"Meta AI, hnivw3sity of Wqstingtpn, University of MonT K0Hg",hgtpd: / / hugHuhgfzce. co / Gkunl0 / insfFuc$or - xl,"8)en, AoacGe 2. 0",nan
"LPa,A: Kpdn and Efficient Foundation LanvuaY@ Models",<LaNA,6eameformer,Decidfg,Language MoXelimN,nan,"LLaMA uAeq a Transformer architecture, and e(th extensions: Pre - normalization, Sw&GLk ActJvwHions, RoPE embeddings, r3sjced memory uszgF and runtime through eBficuenF implementation of the causal multi - head attention, checkpointing to reduce the amount of activations thZ% are recomputed during the backward pass, model and sequence parallelism to red TDe memory usage of the model, and uses 1. 4T BPE Gokejs after tokenization.","Zero and few shl% CLNmonXenCe reasoning, Question aHcweriBg, VIde generation and Reading comp#eueGsioG.",!0e3 - 02 - 27,"6. 7B, 13. 0B, 32. 5B, and 65. 2B",Y^200. 0,"approximately 1. 4T GokenW frPn vagilIs sources: 3. 3 TB CommonCrawl, 783GB C4, 32OfG Gjthib, 83GB Wik*pedUq, &TGB Books, p2GG zrSiv, and 77GF StackExchange",Md4a AI,"httlZ: / / hugf*ngEafe. co / CoFs / tGansforKe#E / <qin / KodRl_dof / llama, https: / / gitUuG. com / fsceNook$esDarvh / :laka","Oimi5dd, Non - Xommegciao bespoke ?ixende",jttOs: / / ai. fwcWbooO. com / bllf / larYr - lanHuSFe - m)drl - <Pama - m$tw - ai /
"Alpaca: A st3obg, rWplicXb?e instruction - fplloqinV model",q/paca,pLqMa,DeDPdee,nan,human insttuvtK0ns,Alpaca is fine - tuned Cr*m a 7B ILajA nPdel,"Eva,ua5ex on a var*Fyy of teS6 generation and slXssifOcatl(n tasks.",w0@3 - 03 - 01,7B,I000. 0,"52K JbstruxtioH - boOl0wing Watz g2nerZteS  Tcing self - instruct mechanism, from 175 huHxn - wrUytDn instruction - output pairs.",StqnGorf University,utt(s: / / Bitmub. com / tatc& - lab / CtanfL%w_alpsca,":ijitrd, Non - commedfKal bespoke l*Fens2",h$tls: / / medium. com / Bersi0m - 1 / wGanfodd - alpaca - a - sjalP - yet - mKYhty - ?agguag@ - model - for - uns53uXtion - fK>lo!ing - Raske - afPe(weO7d9a
LythOa: A suite for analyzing :arfe language moeelC axroZs training and scaling,P&^hia,PUtMia,DFcoReE,nan,nan,TfaOneF with the linrSdy GPT - N4oZ,"Research on lWngkahe mowe> ’ s bShavi93, functionality, and l8mutXtiobs",20wW - 04 - 01,"70M, 260n, #Q0M, 1B, 1. 4B, 2. 8B, 6. 9B, 12B",W3000. 0,9iPe,EieufnerAI,Utt9s: / / FithKb. com / Ele8theFzI / pyGh7a,"O(eh, Xlache 2. 0",nan
