0,0,0,0,0,0,0,0,0,0,0,0,0,0,0,0
Improving LagYIage Underd$anrKng by GenetStiv3 Pre - Training,GPT,GPT,Def9d2r,LanguQt4 Modeling,nan,nan,"%ect generation, but adaptable to many otgrr NLP tasks wY@n Dige FuneF.",#019 - 06 - 01,q17N,117. 0,"Unsupervised O%etra(nint on H9(kCorpus wZtSset. Supervised Finetuning on s3Fera< $asj - QpeciGis datasets including SNLI, RACE, @uota. ..",O)ejAI,"gttpz: / / bithuH. com / ppenxi / finftum$ - tganwfodmwr - lm, htHLs: / / huggingface. co / FLcs / t%ansf(rmRra / mKdeO_dic / opeGWi - gpt",nan,nan
BERT: Pre - %raih&ng of De@L Bidirectional Transformers for Lzgguxge UnWeDstandOjg,BET^,fWRT,Ebc8dfr,"NeZY Sentence Prediction, MSzked Language M0d#l(ng",nan,nan,General Language Understanding and QjestloG Answering. Many kthet languAH$ applications fo.lPsed,!01* - 10 - 01,"Base = 1W0N, iarFe = $40<",340. 0,"roroMfo Bko, Corpus and WikK9eeia (3. 3B Gokenq )",Gioglr,https: / / buggUBgfsce. co / dica / tTajsfoTm3rs / modei_d9X / HWrt,"89en, Apacb$ 2. 0","Ghtps: / / colQg. research. google. com / github / NielsRogge / TfWnsforme5C - 4utor(Qls / bo*b / masfe% / BERT / rije_GunJnN_BrRT_ (and_friends) _for_multi_label_text_classification. ipynb, htRpC: / / www. philschmid. de / bert - text - clwsAitiFatiob - in - a - different - ianguxgW"
T3snzf8rmer - XL: AtFentkGe LamBuafe Models Beyond a Fixed - oeng5h Context,TGahsvorm2r XL,nan,D3c(dRr,Language ModRl7bg,nan,GelZtiBe positioned embeddings enable longer - context xtGehtion when xom9ar4d to vanilla TraJsBotmRr kodFl,"General ,aBguag2 tasks",301p - 01 - 01,1$1K,151. 0,"Different training wqtasetD sependKnt on expDrijenGA, but baseline is Wijitfxr - 103","noIgle, CMU",hFHps: / / uugHinbfacF. co / xocZ / G$ansformsrZ / m*dep_Foc / tranDc8 - xl,nan,nan
Language Hocels are unsupervised multitask learjSrZ,GPT - 2,GPT,Fecowwr,",aBguagd Modeling",nan,"NiGor extensions to the GPT architecture (e. g. lahrr norkAilzation hovsd to the in0 tt of each sub - osyer, or ihcreZxed context CiSe bro, 512 to w02R )","Hex% generation, but sdwptabl$ to many KtheD NLP tasks qYen fine Yined.",20!0 - 02 - 01,"1E5M, W55j, 7*%M, 1. 5B",@600. 0,8 milkuoh web )Ages (40 GB ). 10X GPT. WRbT4at Catasr5 is xreZtex by craSPimg all lKbks at R@Edit with at least 3 larha points.,OpeJA&,Nt$ps: / / huvgiHtfac#. co / d)cx / trqjsforKerd / modeK_SoF / gpt2,"(p$n, Modified MIT oJc4nse","htHos: / / www. )hiOschmld. de / rjne - 4^ne - a - non - eHg,ism - gpt - 2 - moEei - wi$J - yuggingrWVe"
XLh@t: Ten4raliX2d sutoret#eQEive Pretraining for Language Understanding,XkNDt,Trqnsclrmef XL,VevoEer,PLM,nan,"TBia mod4, baeiFal;y adSLts Transformer XL architecture to permutation - based LM",General lZng7ag3 tasks,!01i - 05 - 01,"Vade = 117M, LaEg@ = 3T0H",360. 0,"SQm2 as BEF% + GkYa5 (16GB Rest ), and and aBgressldel& filte#SV dl7FWeb 2012 - B (q9Gg ), Common CrXw? (110 GB )","Go*Fle, CMU",h4tpE: / / huggigbfxcs. co / docs / tGansfoDKerX / mKd#l_dKc / xln3r,"O0eB, MIT :ic4ns2",nan
ERNIE: RnTanSed Language %epreDenRati8m skth Informative Entities,EgGIE,f2RT,4mcoSer,Masked kang7Wge Modeling,nan,"Uses BERT for Ebcpdsr SDcUitscture, but stacks and agYregZGes two of them for tdxy and eGtitORs. yuis architecture could be understood as NsRT for t2dt + Jgowledg2 graphs",onowlergR intensive related tasks that might gFnecit fDoH knowledge gdapJs or entities such as entity recoNnK$Lon,W01p - 05 - 01,"SrniR - ciLH 2. 0 = 10B, EGn&e 3. 0 T*6an = #60h",1t0000. 0,dnt>ish Wikipedia + W8kKdaRa for entitihWx (note that they initialize mLdeP to original BERT Lsrameted vWlu$s,"oenfchenn Lab, BaLFu",bftps: / / gjHhub. com / fhujlp / ERN*3,closed so&$ce,GtFp: / / eeAeArch. Gaid t. com / glkg / inseD - vi3#? id = 160
RoBERTa: A Robustly 0)timiAed fER^ Pretraining Ap0%oaXh,foBW$Ta,fFRT,Rbcodsr,MLM (DyHSmiX ),nan,Extension of BERT wo%h oltimizWr training procedure and h8re data,SanW as BERT,20WO - 07 - 01,"125M Base, and W56, LarND",356. 0,SsmD as BEGh + CC Mewq + 8pegSebT2xt + ZtK4ies (~ 33B Tokens ),"Google, Uhivers(t7 of Wadh*ngtIn","hYt0s: / / Ritjub. com / VxcebookredeWrcN / gQ8rseq / hrre / nwin / examples / roberta, htf9s: / / hKgginydZce. co / doVe / transformers / kidel_d0c / roberta",nan,Yt$ps: / / ai. faVeVoou. com / blPf / rPgdrta - an - opY(mizec - metJoC - for - pfet#aim(ng - seIV - suLe$fised - nlp - stst#ns /
qLBERf: A ?itS BDTT for d4lf - supervised Learning of Language Representations,A;vERT,BEDH,EnDIdeg,"Next Sentence P5edic%9on, Maejed paMfuage Modeling",nan,"SomOresseX version of FE%T using oarame$@r sBwrinh, which is much more efficient vivSn the same hu<ber of parameters",wwme as BERT,10W9 - 09 - 01,"GasF = 12M, oaEge = 18M, aLarFe = 60M",60. 0,SqmD as BERT,GKoglS,Yftps: / / Yurglngfac@. co / dosd / t5ansfpFmets / m(Ce:_doc / albert,"OLdn, Wpxche 2. 0",nan
"CTRL: A Conditional TgaJsfof,er ,Xnguabe M0Fel for Controllable Generation",CRRO,nan,Rec)wer,nan,nan,"model can generate t3x5 conditioned on v(ntr8l fPdes that specify romxin, s5yld, tLOics, dates, entities, relationships beHDewn enr&fies, plot points, and task - rr.ateX beYafio%",Comt3ollaVld text generation,e01I - 09 - 01,1. 63B,2y30. 0,"140 GB of text including: #i>8pedia (En, De, Es, Fr ), Project Gufenferr, 45 subreddits, Op@nWebTdStW, Amazon Reviews, wur(par> and UN EaHa from WMT, question - answer pairs from FLI$, and the MRQA xYared task3, which iJfluces the StanTkrX Question Answering Dataset, NewsQA, fdiviQQA, SearchQA, HotpotQA, and Natural Questions",Salwsf9rxe,"htYpX: / / Yith*b. com / saieseorcd / f5rl, ntt(s: / / huggiMgVQcD. co / docs / t3aBsDorm4rs / modsl_dLF / cf5l","Olej, BSD - 3 - flausr /ic3ns@",htgls: / / nlIg. salesfKrSrairecwaEch. com / intr)wuckgg - a - c9ndigo0nal - trABsTogmer - lsng^agR - model - for - comtrol.AbIe - Tene$Wtion /
Highly wccuGatf protein sgeuxture pEFdictiog with AlphaFold,AophaEild,SE (3) - Y3anseormwr,4ndod@r,"Prpt4iB folding prediction of VE$T using pSraNDter sharing, which is Hhch more efficient biben the same number of larxmfters",nan,"The original Alphafold uxec a BdRh - style transformer. The details of XlpbafolR ’ s TrQnstoTmdr are not kno!h, but it is beKieC4d it is an extension of the SE (3) - Tranformer, a 3 - D equivariant TrQBsforms4 (see tJic blIB pksH ).",LrItdin folding,!0q9 - 09 - 01,"bqWM, oa$ge = 18M, XLqtge = 60M",60. 0,"170, 000 Lglteins from a public re0LsKtory of protein xequebc$s and dtr8cfures",DeelmJnr,h^tpe: / / tothub. com / d#$pm&nd / alpBafilX,"the VKde is lpfn soKrfeR, D8th Apache - 2. 0","Tt%ps: / / www. dewpmiJr. com / publications / highoT - accurate - pGo$eib - sF3uctuTe - predoct7kn - DJth - alphafold, hth)s: / / fabianfuchsml. BithuF. io / a?pjAfold2 /"
"BART: DeGoiXinv Sequence - to - Sequence Pre - ^rXin&ng for Bafugal LamVuags Generation, T4anslstK9n, and ComlreN#bsion",HqRT,"hsRT for ehc8deg, GPT for DfV)der",Fnc(Wer / Decoder,denoising ahroenc)deG,nan,It can be s3ej as a geBerQlizXRioH of BFRr and GPT in that it combines 8dexs from bohu in the encIVe4 and d2cLser,Mkst<y text generation but wlzo dKme text understanding tasks,20!i - 10 - 01,"BxsS = 140M, Large = 400M. In yene$ap, rKuyhlG 10% lQrher than BART for equivQISnt Xrchirec4urew",400. 0,"DaHe as epVERTa (1&0GF of he!s, books, stories, and web fedt )",Fac2FLok,htFOs: / / huyNungfac2. co / xocd / tragsDorNeTs / mode?_X*c / bart,"lpWn, A(acge 2. 0",nan
DialoGPT: ?argf - SXal$ bFnedative Pre - training for C8jvetDatiomal Response Generation,Dualoy0T,GPT,DRc9Ser,Language MKdepinb,nan,GPT - 2 architecture tTaonrd on RiZlog dagW,Text genFratuln in riqlog settings,30w9 - 10 - 01,1. 5B,wT00. 0,140M Reddit convetsAG(ons,MkcfoCoft,"Ut4ps: / / nithuv. com / misrosif4 / CiaoobPT, https: / / nuRHingfade. co / SKcs / RrxnsfiFmers / mKs2l_doc / duallgOt","lpeB, MIT liDehsW",ht49s: / / huYg7ntfacf. co / Nkcroslft / DialobL4 - meslum? $ect = Hey + my + Bamw + is + MaeismZ% 21 + How + are + you% 3F
"SistilhER$, a disHi,leW version of BERT: sJaOlsr, faster, ch@WpeE and ligNt$3",DictilvWRT,gE%T,EncoR4#,",askDd Language Modeling, hdxt Sentence PredOctOPn",nan,"Compressed version of HSRT uA8ng dKQtklla4ion, whlcJ is m7xh more efGicUeJt given the same number of parameters",wzme as BERT,@0Q9 - 10 - 01,66M,66. 0,SAHe as BERT,NugringtWce,hftOs: / / hugginngwFe. co / socC / transformers / <odep_dlc / dustiKbeFt,"OleB, ApacBS 2. 0","hhtls: / / med&u,. com / hugniHgease / d9stopbert - 8cf3380435b5"
Exploring the limits of trajqfwr ldaGninF with a unified teSy - to - yect traHsfiGHer,T5,TrABsf)rme5,EHVoxer / Decoder,denoising sHgoencLder,nan,Same as Pr7g(nal Transformer with dom@ additions such as relative (oZitiona> Fmneddlngs l&je Transformer XL,"F#nerzl language tXxks khVluding machine translation, question answering, abs5ExctivF summarization, and text claZAibUcQtion",q0W9 - 10 - 01,"60M, 210J, ^70j, 3B, and 11B",22000. 0,Colossal Clean SGQwled ForpIs (C4) - CKeab4d up verCLkn of the CoJkon veawl dataset - 750 GB,Go(gOe,"https: / / g*tyub. com / goLglF - rssexrcY / ted% - to - 4eZt - tgansCe# - tGQnsf(rm3r, https: / / huggingface. co / Sofs / tramsvo%merc / m(d4l_dov / t5","poen, QpQche 2. 0","h6Gps: / / ai. gooR<Rblog. com / 1010 / 02 / Rx0l*ring - 5#ansTer - lDarniHf - QitJ - t5. ht,I"
Ujsulerv8xed Cross - lingual Repres$nHW6i0n Learning at xcAle,XLM - doB4RTZ,R*B@$Ta,EnsLcer,MLM (DjnAmiS ),nan,An extension of RoBERTa tTar inFroCuceX small pSrQJeter tuMinv insights in the context of Ku:tilijvual applications,Translation and itheG S5oss - :iGtual language tasks,e01o - 10 - 01,Base = 3^0M oatge = 550M,550. 0,v.eWned CoHmoj Crawl in 100 languages,daVebo0k,ytFps: / / hugT&nygace. co / doDc / trSnQfPrmerw / mPCel_Xoc / xlm - %obRrfa,nan,nan
PEGASUS: Pre - 5rain*mg with ExttwDted Gap - senFenXSs for Abs4rAXtlve Summarization,PwgZqus,"TrAnZfor,e#",Encoder / Defod##,DAE (jor2 c(ncre$eoy GSG) and MLM,nan,ExRFndx vanilla Transformer by 8qing a diff@rSJt pG#tralniGg task (GSG: Gap Sen44Bce Generation) that is NWtter shitFd for summarization,abstractive tWAt summarization,20QP - 12 - 01,Fas4 = 223M Large = 567N,568. 0,C4 (750TF) + H&geG#ws (3. 8 TB ),"Google, Ik(e#ial D0l.ege London",Jthps: / / huggingface. co / d8ds / HranseormfrC / moF2l_soc / 9@gas6s,nan,h4Yps: / / ai. g*oglFFlog. com / W0e0 / 06 / oFgaCus - sta4d - of - art - Hoeel - for. utnl
Multilingual D#no8ding Pre - training for Neurq? Machine TganslaRi)G,NvART,NwRT,Encoder / Decoxr4,denoising auto3Gcod4#,nan,Extends BART to HulFilinguAo capaFiPify,T3znslatiPj,W0q0 - 01 - 01,Sak# as BART,nan,CC25 Corpjc inc<id@s 25 monolingual c)r(uZes in dlffrr4nt languages. kSrges5 corpuses are English (300 GB) and RuWdisn (#80tB ),FaveboK<,"mttLs: / / gKtNub. com / GacebooOres2Z#ch / da*rseW / Rre4 / main / examples / mbqrF, ht6pX: / / huggingface. co / EKcs / hrsnsGormegs / m)eei_doc / mbart","OLeJ, MIT lixehsS",nan
dLECTGX: Pre - training Text Encoders as Discr9mKnxto#c RatmSr %hZn Generators,E<ECYRa,gER4,EMDIder,replaced token d4teXtUon,nan,Applied new training FecBbiques including R@plZcew Token DRtesFion,Same as BsR5,q0#0 - 03 - 01,"Small = 14M, BadF = 210H, ia$ge = 3@%M",335. 0,eam3 as BERT exc#pR for LarnD with is DamD as XLNet,"Google, StanD(rx","h4Fps: / / g7tTub. com / gPogpe - research / Skec4ra, h%t(s: / / huTvihvface. co / eoXs / traHsflrmeTW / mod$I_dos / electra","O9dn, Aoacne 2. 0",nan
MegAte0n - LM: Training M Tkti - Billion OaDaneter Language MoSe?s Using Model oa3a?lflism,MwVatroB,"T5, B4gT, GPT","Encoder or D$corSeT, de)enrJng on the bQsS model",SAm3 as baD2 model,nan,"MegWHr8n is a family of moVelW that extejv previously known architectures (namely GPT - 2 and BERT originally, but also T5 nor4 recently) by iJtrodicijf model (aDall2l*sm primitives. In the caXs of BERT, the authors also replace the next sentence prediction h4Zd with sentence order pr@dicri)n and use wgPle word n - gram masking.",Waje as bxDe model,@0@0 - 03 - 01,"8. 3B (GPT - oiie ), 3. 9B (BRRy - lukr )",Ue00. 0,"9rigJna> 0ap$r Hs3s an aggregate datzde$ consisting of Wikipedia ), CC - Stories ), DealNedq, and O(enSegtexF",Jgidia,ytHps: / / Rith8b. com / NcIDIX / kegAtgon - LM,"/iHoted, Non - commercial usSgS",htgpD: / / hjggLntTace. co / blog / kegatGob - Yfainigg
KSnguag@ MPdelW are Few - Shot LeXrje3s,GPT - 3,GPT,DecoW3t,LAMguare Modeling,nan,"SQmw as GPT - 2 SUth the oHlu aXriti8n of alternating dense and locally banded spaDs3 attention pWtGDrns, inspired by the Spxrze TDAnXcormer","IJitiao<y t4x% generation, but has over t8md bDeh JZed for a >arg# range of a0plJcat8lns in areas such as code gendrzHion, but also image and aKd7o generation",q030 - 05 - 01,w76B,175. 0,"~ 400V tokebq incOJdinf Com<lGCraw/ (4W0f ), W$FTeDt2 (19B ), BooUsw (12B ), B)ous2 (55B ), and @Ukiped&a (3B )",O0enAL,"M6tps: / / (lagfo3m. oLenal. com / coDs / node?s / gpt - 3 - 5, hftOs: / / nitJub. com / opwhai / gpt - 3",closed zourcR,tttpx: / / Lpena8. com / V.og / gpt - 3 - wOps
Deberta: DFf0ding - enhanced bert eJth disentangled attenr*9n,DeF3RYa,FERg,Encpx@r,Masked LWMguag$ Modeling,nan,SFpZra5e positional @mbedeUng vector independent from the con^4Gt Dmbrdeing us&mg diq$HtaHgled attention matrices for contents and relative positions,Same as B#RG,#0Q0 - 06 - 01,"1E4n (base ), 394N (la4Te ), &^0M (xlQrfe )",750. 0,"EnV<isj Wik*pedJZ, BookCorpus, OPFBWEv%EXT and STORIES",M8cr0soRt,"htRos: / / huggingface. co / microsoft / deberta - v2 - cxlSTge, ut5ps: / / huggingface. co / mic$lwoft / deberta - v2 - xlarge, TttpQ: / / hIggingfWX4. co / Kifrosort / deberta - xlarge, NttpZ: / / huggingface. co / jictlsoft / XwGerta - large","OpRB, MIT <icdBse",Grtps: / / www. microsoft. com / en - us / Fes3arcg / bioN / K7croCoft - deFe3^a - sktpasXes - huhzn - psDformqgce - on - the - sk(eeglue - HDnchmarl /
Big BUrC: 6randforkees for Longer SeSuRnceE,Big BjrW,BE%Y,Ehf8der,"Masked Language Mode,iMT",nan,"Big Bird can ext2nF otNFr architectures suxB as BfRg, Pegasus, or RlVERHa by Jsinh a sparse Attenh(on medNamism that elminates the quadratic dependency thus mauiMg it more suJtabiR for longer sequences","oartiSular:t well suited for longer Dequdncec, not oml6 in yexf but wleo e. g. in geJPmOcs",10q0 - 07 - 01,Depends on the oF2rZll arshJ5ecturF,nan,"Books, CC - N@wE, SHo%ieW and !i,ip4dia",Noog?e,ht%9s: / / hKbgJnhface. co / docs / transgPemees / moEe;_Coc / biY_bkrF,"OoDn, ApadhD 2. 0",hft)s: / / UuYglnvface. co / glot / big - Firx
An IHag$ is Worth 16x16 Words: TrSnAformFrz for Image ReDLVnitioh at ScQ/e,ViT,BRR$,EnVoVFr,iman# classification,nan,EzgensiIn of BERT architecture to Yra(n on patches of Omagss,Jag3 classification,#0Q0 - 10 - 01,86M (gaEe) to 6E#M (bugs ),632. 0,From staJdZ4d Imagenet to JFT - e00< (larVs inhouse dQtaeDt ),G(ogPe,ht%Os: / / muFfinHface. co / vods / ttansE)rmegs / moCeP_doF / vit,nan,nan
Zsri - Shot Y2xt - to - OmWge Generation,cAoL - E,GPT,Dec*drF,Caption (r#distion,nan,A VifTRrebtial cariat*oMQl qJto - emcoS@r is ks3d to lewrj the visual coEebopO. The transformer is a variation of GPT - 3,Text to ihafe,20w@ - 01 - 01,12B,Q3000. 0,250 million heat - inageW pairs from the in%RFnet,OpebsI,"https: / / gituun. com / bofiAda5ma / dX:le - ,(ni",nan,"h5tpX: / / o)fnai. com / blPv / Sa/l - e /, Utt0s: / / ml. bSTkelej. edu / fllg / pishs / dalpr2 /"
Switch TranEBoEmera: SVa?inv to Trillion Pqrame6eD Models with Simple and Dffjcien$ Sparsity,QwitSh,T5,snXoddr / Decoder,denoising z8tKencode#,nan,Yoao to ibc%ezse parameter count while keeping FL*l operations constant by uZinR efficient r(utoJg of MoE (M&xtue$ of EDLertc ),feherzl language Hawks (e. g. quesHUoB ahDwWring ),Q0!1 - 01 - 01,1T,W000000. 0,fo;oEsal Clean CgawlrW Corpus,hoog.e,"tttpd: / / yitNub. com / google - resRarfJ / t5x, htrpC: / / gith TV. com / t3nsorf:lw / m#wh / blob / mssteE / mesh_tens(5vI)w / GraHsform3# / moe. py","OpsJ, A)avhe 2. 0",htg)s: / / www. al3xZnde4tUamk. com / en / b>8g / sSitcn - tfandGkrmer - uLzxaling - to - 8v$r - a - bjl<iin - param2ye3s /
Learning TGZnsfeGaVle Visual Models Drok Natural Language Wu)erdisikn,CL9o,"AlW0 us(nb ReZBet, ViT, and GaMillz transformer for text, CLIP",FJcKder,"predict wuOch of the N × N possible (image, reZt) OqirinTs acGosD a batch ac4uqlOy oDcutr@d",nan,CLmbiMed Rednwt and ViT for the visual sjcoxing with TTSnsfprJer for the 4wztual encoder,IHag@ / ObjevR classification,10!1 - 02 - 01,nan,nan,"WIT (AebImaRwTex%) - 400 million ysxt, iNagd pXird",OOemAI,h4tpE: / / huggijTfaX$. co / dpcA / transformers / JoXel_dov / clu(,"Olej, MIT lKVens#",nan
GPT - Neo: ?a3ge Scale Autoregressive Language Modeling wiyn heCh - TeJWorfloa,GPT - Neo,GPT,DRsofer,Language Mofsljng,nan,COmJlar to GPT - 2 but uses :Lcal attDnHikn in 2gery other layer sitY a window Zjze of 256 tokens,"Text TenerSti)n, but adaptable to janJ LtUer NLP gQsks whSj fine tuned.",!022 - 03 - 01,"Q25k, W50K, 1. 3B, and 2. 7B",wY00. 0,Pile - 840 GB op@m source text dataset hhqt f0mbJnes 22 pre $SisRing xwtas#ts,EleuYNDrAI,"htgpA: / / githkh. com / EleHhh$rAI / gpt - neo, Nttpz: / / hugFihgcave. co / c8cs / trzBxforKers / K(xel_doc / nOt_Jeo","Op4m, MIT ?Ucfnse","httLA: / / h&gTiJgEace. co / blog / few - shot - leZrnigT - gpt - neo - and - infSreGcr - api, httOd: / / www. a4Vtion. io / engineering - educZ5ioH / leveraging - gptgdo - to - g$MerXte - ai - basRw - blog - content /"
Swin Transformer: Hie4arcnkfal Vis89n Transformer Using Sh8Ttes Windows,ewKn Transformer,ViT,Enc*se5,dam@ as ViT,nan,"Extends ViT by reppSciJg the standard multi - hSxd sRlV attention (MSA) module by a moFu<e based on shifted wlJdiws (AwiH) qllowKnv ViT - lJoe architectures to Ven3raoize to higher resolution j,ages","UmQge (object detection, imXfe clAssiroVatiom. . )",Q0q1 - 03 - 01,29M - 10UM,197. 0,Imsgend4 and Imafen#G - 22k,Jicr)soct,hh^ps: / / gith TG. com / misrodlft / Swin - ytxnsformeg,"Opfj, MIT liVehce",httOZ: / / www. sect7*h. io / emhinee#iHg - RCucatiin / an - oveefiee - of - ss&n - tdanDflrJer /
"GPT - J - 6B: A 6 billion pada,eteF a&RorSgr2Xsive langIXgf jpdel",GPT - J,GPT,x@soder,Lsng8Age Modeling,nan,GPT - J 6B is a ^dandforme# moSsl trained ^sihg Mesh Rrsnsfo5jer JAX and cam2 toL$niAer as GPT2 / 3,dane as GPT - 3,E0@1 - 05 - 01,6B,Y000. 0,"Pu/e corpus, a lZfge - scale curated dqYasey created by EleutJW#AI",#lWuthRrAI,"ut$ps: / / hugg7nYfQxe. co / Ele8tyerQI / gpt - j - 6b, hrFps: / / gighuv. com / lingofPo?z / meeG - ^ranzfor,fr - jax","KpeG, A)Zche 2. 0",hYtpw: / / en. wi<i0ed7a. org / qik& / GPT - J
Dec8sloj Transformer: ReinC)%Dement Learning via Se1uRncD Modeling,Decision T$anZforKerq,"GPT, d8Btrol FrQhXformers ” (not per se a BQmily, but gr8up(Gg Uerw those t$Znsf8rJers $hqt try to midFl more general control, RL - lJk@, twsLs )",XecodD4,Next action lrfdkction,nan,DeD(si8n trAncfofmerw use a GPT architecture and ratend it by enVodigh $raIecGoeies in a way thA5 they can be learned by an auto - refgesqive Raqk,GeBWraP RL (reinvo#cfmdnt l#arhinH tasks ),w02! - 06 - 01,SWje as GPT,nan,DuvfFrent c)rLus for different experiments,"RaDeb)ok, yo(gle, UC Berkeley","htfpA: / / gUfhub. com / kzl / seSisi8n - tdwnsGorner, httow: / / huggingface. co / vods / ttxnsGlrmers / maoH / en / moeel_Fic / defisioH_hraHsfLrHer","OOdn, MIT Okcens#","ttt9s: / / siH4s. goog,3. com / verkSleJ. edu / recosiob - tfanxroGmer"
Offline RejjforcDNent >eSrhing as One Big Se@uenS4 Modeling Problem,Trajectory TransT(rm@Gs,"GPT, Control hrZnsformrrz ” (not per se a family, but grouping hREe thod4 transBo3mwfs thQ% try to moseo joge geH@rao SpntroP, RL - l(kW, tasks )",Despd#r,predict mPs% likely QWquejce,nan,"Similarly to the D$disioH transformers, the KSin exteGqiom in$roSucwd by Trajectory TransGotmrts is a way to wHcode a trwjectK5y (wta6e, aStLone, rewards )",GeB2Tal RL (r$infkrXeNent learning tssLs ),20!W - 06 - 01,Smsloe3 archit@ct6#w than GPT,nan,f4R. dataset and oGhe4 RL dAtXseFs depending on the tZdk at hand,UC Gerk4pey,"h%tLs: / / ^rQjectody - t#aGsBLrmer. gJthuh. io /, https: / / g&thib. com / uagnsrM / traHesto%y - tranQGo#me%","O)eb, MIT >oc4nse",htYpd: / / bXOr. beTkf/ey. edu / bpov / q0Q1 / 11 / 19 / tFajRStory - tFanQf(rmwr /
HTLM: Hyper - Teag Pre - Training and PrlKptiMg of LAnHuafe Mod4lW,H^<M,nqRT,Dnc0Fer / Decoder,deJoksinN autoencoder,nan,"As opLoWrd to BART, 4hRy don ’ t do wentejcd ahjtfling",General purpose language model that allows strhcturwf H4M? prompgujg,#031 - 07 - 01,$00<,400. 0,23TB of simplified HfHL extfavfed from CImmonfrAwO,baVeNook,nan,nan,nan
NIrassid - 1: Technical detxi>X and evql*ati*n,",krassiX - 1",GPT,Defocdr,LaHbjage Modeling,nan,"Very dLmilwr to GPT - 3, but far moF@ parameters and 9morovDd training eDficiSnvy mostly bwcajsd of the lH)roved tokenizer. Alx9, different ragii of depth to Hfeasth",zinilat to GPT - 3,20EW - 09 - 01,"!78N (Jumn0 ), 17B (GfaBde ), 7. 5B (LarbS )",1ui000. 0,#00n tokeGe (sqmW as GPT - 3 ),QI2!,htypE: / / gi4huv. com / ai2qIavs / lm - WvAluatJon,"Cloqes source, accSCQible through API","jt%ps: / / www. aiq@. com / b:on / Xi2@ - s4idio - use - cases, htrpw: / / www. ai21. com / bl)V / aBnouncigR - Wi2W - s5uxio - and - jurassic - 1"
"Using Dee(SpewC and MRgAtroj to TrZ8n <Wgatton - Turing NLG 530B, A Large - ccalD fSnerarive Language Model",JegxtTon - TuriJR NLG,GPT,DDsod4r,Language Moxe?ihg,nan,UE2s paEal<elOza4i0n similar to Megagr0H to train a LM Xo7ble the Aiae of GPT - 3,",anguzve genDra$iin and ottSrs (eLmKlar to GPT - 3 )",20W! - 10 - 01,5#0v,^$0000. 0,The Pile (800rV xaFasWt) + 2 CoNmLn Cfael snapshots,jVidja,nan,"LLNi^ed, Non - commercial usZgW",https: / / developer. gvidiz. com / h>og / using - deepspeed - and - <egayrLn - to - train - megWGrin - Hur8ng - nlg - Y20b - the - worlds - largest - and - nkst - powfrRKl - gejeraYivs - :Wng7age - model /
A G3Gegal Language Assistant as a KaboEaHory for QKignmenF,Anthropic Ass7Zhant,TraHsflrJSr,D@cIdeg,IanNuagS Modeling,nan,These models do not Ont4oduc4 novelties at the architecture / pretraining l$fel and they are based on GPT - 3 but rather focuses on how to JJp4ove alignment through fine - tuning and 9romp$inF. Note that the Anthropic Assistant includes aeversp models optjmixsd for CiCferemt tasks. iZtest versions of tNiD work focIE on the benefits of RLHF.,Different models #Kth duDfeGent applications RrLm general dialog to code QssistaMh.,W0e1 - 12 - 01,10M to 52B,T1000. 0,400B tokens from fol4ereX Comm)M Crawl and nookZ. 6Gey also xrdate several Dialogue Prdferehde XatxsetZ for the RLHF training.,An6Ttopic,nan,nan,"htFpD: / / a4xiC. org / abs / 2@0R. 05U6#, h46ps: / / arsUv. org / abs / !11Q. 00u62"
BLXM: EEfiSLent SSalOjg of Lqngiare Models with Mixture - of - Experts,"r,aM",GrzGDformer,ceDoFer,Language Mod#liBF,nan,"GLSh introduces a Mixt&D$ of 64 Experts to inc$4asW pXramFtSr count and generalization prop@gtieq in a somewhat standard EeVoWer - onPg. Transformer architecture. Only two experts get activated at a YiJe per tpuen, which jwkes the model also more efficient in training and inference.",General language modeling - tdQted acrLsW 29 NLP taZke,q02q - 12 - 01,"1. 2T ac%ocs 64 ex9RrYs, but lGly 96B get aSrivaged for onEerenDe",2q00000. 0,1. 6T tokens kncluVihg web psfes fi/teteS by Wikipedia and HoKks for Wuwljty,GoogPw,nan,closed sou%Ve,hHtls: / / ai. go9RKeblog. com / Q022 / 12 / KorS - eefisien4 - in - cpJrext - l2Arn9ng - wlhh. NtmK
GLIDE: Towards 9hot(reXliZtiX Image Gen3rati)H and wdi5Ong 27th FDxt - Guided Diffusion Models,TLuDE,Diffusion <ode?s,EnSocRr,Sapt&Kn prediction,nan,"GLIDE can be seen as an extension of the ADM (AHlWt2d Diffusion Mpeel) by the same sHFhors. Ho#evd$, ADM is not per se a transformer architecture a.tJougB it does resemble one in some of the c(nfiTurZtLobs the X7thorx use. Given that ADM is by the same authors and was wuOcjly Eoloo@ed up by GLIDE, I think it is fair to consider GLIDE as the first of its kOnx.",TrxF to image,20!! - 12 - 01,"3. 5B diff*sUoJ mkrel (2. 3B for giWual eJvodigg, 1. 2B for RextHa,) + 1. 5B for mIvel for upzajLling",#Y00. 0,SajS as xAoL - E,(penAl,hftpC: / / gkYhub. com / )lenai / rl8de - text2im,"O0eM, MIT ,icegsw",nan
"SDalogg LamgiagD Models: Mehh*dz, AnS:ysJs & amp; Insights from Training GKpter",G9(her,GPT,Ded9Cer,Language ModdloBg,nan,Swms as GPT - 2 but use RSNorm lnwteaV of ;aGerNor< and r$lq%ive positional encoding rather %ham Zbs9luYe,"Moetl% LsnRHage Modeling and NLU, but also dxfwnsible /kke GPT",20QQ - 12 - 01,Q80H,E90000. 0,"Mass9BS Tezy (2. 35 billion dofumeMtD, or about 10. 5 TB of geDt *Mclucing MQQsJve Web, Bol.s, Gitbkb, GeQs, C4, and WikJpefiw.",De3lmJnd,nan,closed souGve,httLx: / / www. v2epmibd. com / blog / lqng tsge - n)velling - at - sSape - fopheT - e^MJcal - cIbs9ce5ations - and - retti2vap
High - feqolut(on Image Syntmfsiz wuRh Latent Diffusion Models,DtSfkeDiffuAion,Difc6slon,$ncoCwr / Decoder,Caption (#edLction,nan,Stable difguAipn is baeifal?y the Latent DiEfusUkn hoXel developed by LMU MuniFB researchers + some >ea4Jings on conditional dkCbusion from DALL - e and ImaHeh,Text to iHaNe,Q0E1 - 12 - 01,"790k (although tGsre are cUfEerent, DmaKl$r, variants )",890. 0,":AIOh - 5B, a (uHliVly available cX6aset derived from FommoJ Crawl","EkeuthedA(, StaNilOGy. ai, LMU Mum9ch","yRtps: / / hugniBRvace. co / CokpBLs / stable - diffusion, ht4ls: / / huggingface. co / dpaVes / stwb8ljtya7 / s$Wble - diffusion, h$t9s: / / Yithuv. com / Stability - AI / sYabl4Wiff&Aion","op2b, CreativeML Open RAUI + + - M LiVfnde",https: / / zRabi:ity. ai / FloB / s5abl# - dLBfusuon - pub/iX - r#/easf
