0,0,0,0,0,0,0,0,0,0,0,0,0,0,0,0
Improving Languaje Understanding bye Generative Pre - Trainning,GPT,GPT,Decoder,Lenguaje Modeling,nan,nan,"Text geraration, but adaptable por meny other NLP tasks wen find tuned.",2018-06-01,117M,117. o,"Unsupervised Pretraining ond BookCorpus dataset. Supervisioned Finetuning onf sevrel taks - specefic datasets incluing SNLI, RACE, Quora. ..",OpenAI,"https: / / github. come / openai / finetune - tramsformer - I'm, https: / / huggingface. co / docs / transformers / model_doc / openai - gpt",nan,nan
BERT: Pre - traing fo Deep Bidirectional Transformers forr Languge Understanding,BERT,BERT,Encoder,"Net Sentence Prediction, Masked Lenguaje Modeling",nan,nan,General Languaje Understanding END Question Answering. Many other languade applikations followed,2018 - 1 - 01,"Base = 110M, Lan = 340M",340. ooo,Touronto Book Corpus are Wikipedia (2. 3B Tokens ),Google,https://huggingface.co/docs/transformers/model_doc/bert,"Opet, Apache Two. 0","https: / / colab. researches. google. come. / github / NielsRogge / Transformers - Tutorials / blob / mastered / BERT / Fine_tuning_BERT_ (and_friends) _for_multi_label_text_classification. ipynb, https: / / www. philschmid. be / bert - test - classification - Im - aa - diifferent - LENGUAGE"
Transformes - XL: Attentive Lenguaje Models Beyound al Fixed - Length Context,Transformes XL,nan,Decoder,Lenguaje Modeling,nan,Relative positionated embeddings enable longe - context attantion when compaired fo vanilla Transformer model,Genreal language tasks,2019-01-01,151M,151. ooo,"Diferent training datasets depending im experimentalize, but baseline wis Wikitext - 103","Google, CMU",https://huggingface.co/docs/transformers/model_doc/transfo-xl,nan,nan
Language modeles a unsupervised multitask learners,GPT - Two,GPT,Decoder,Languaje Modeling,nan,"Minor extentions do there GPT architecture (is. g. layer normalization moved to tje input of each sub - lawyer, ou incrased context syze from 512 e 1024 )","Text generation, bad adaptable to may orhers NLP dasks [[whe fine tuned.",2019-02-01,"124M, 355M, 774M, 13. 5B",1500. oo,8 mln veb pages (40 Gb ). 10X GPT. WebText dataset as created x crawling alle links ta Reddit whitch at least 2 Karma points.,OpenAI,https://huggingface.co/docs/transformers/model_doc/gpt2,"Opet, Modified MIT licese",https: / / www. philschmid. die / five - tune - and - no - inglesh - gpt - two - modell - hit - huggingface
XLNet: Generalized Autoregressive Pretraining ffor Languague Understanding,XLNet,Tansformer XL,Decoder,PLM,nan,THis model basiclly adapts Trasformer XL architecture you. permutation - based LM,General language taks,2019-05-01,"Base = 117M, Lan = 360M",360. oo,"Some ass BERT + Giga5 (16GB test ), anr h agressive filtered ClueWeb 212 - B (19GB ), Commom Crawl (110 Gb )","Google, CMU",https://huggingface.co/docs/transformers/model_doc/xlnet,"Opet, MIT licese",nan
ERNIE: Enhanced Languague Representation wi Informative Entities,ERNIE,BERT,Encoder,Masked Languague Modeling,nan,"Uses BERT for Encoder architecture, but stacks et aggregates twu of they for text atch entities. This's archtecture cuold be undestood as BERT for text + knowledge graphes",Knowledge intesive related tasks tkat migh benfit from knownledges graphs or entities such as entity recognition,2019-05-01,"Ernie - ViLG 3. ooo = 10B, Ernie 15. ooo Titan = 260B",260000. ooo,English Wikipedia + Wikidata foe entitites (not that thy initialize modle ou origional BERT parameter values,"Pengcheng Lab, Baidu",https: / / github. am / thunlp / ERNIE,closet source,http: / / reserach. baidu. come / Blog / index - veiw? is = 160
RoBERTa: I Robustly Optimized BERT Pretraining Approach,RoBERTa,BERT,Encoder,MLM (Dynamic),nan,Extension oof BERT with optimized traine prosdure and more data,Some as BERT,2019-07-01,"125M Base, anhd 356M Lan",356. ooo,Sam als BERT + CC New + OpenWebText + Stories (~ 33B Tokens ),"Google, University od Whasington","https: / / github. am / facebookresearch / fairseq / three / mains / exemples / roberta, https: / / huggingface. co / docs / transformers / model_doc / roberta",nan,https: / / is. Facebook. come. / bog / roberta - and - optimized - mathod - forward - pretraining - sefl - supervized - nlp - sistems /
ALBERT: A Lite BERT form Self - supervised Learnig f Lenguaje Representations,ALBERT,BERT,Encoder,"Nexr Sentence Prediction, Masked Languague Modeling",nan,"Compressed version of BERT useing parameter sharing, which i mych more efficient give thw same unmber of parameters",Sam as BERT,2019-09-01,"Base = 12M, Lan = 18M, XLarge = 60M",60. o,Some as BERT,Google,https://huggingface.co/docs/transformers/model_doc/albert,"Opet, Apache Two. 0",nan
CTRL: I Conditional Transformer Languge Model fo Controllable Generation,CTRL,nan,Decoder,nan,nan,"model ca generate test conditioner an [[controled codes that specify domain, styly, topics, data, entities, relationships batwin entities, plot points, and task - relationish behaior",Controllable test generation,2019-09-01,one. 63B,1630. and,"140 Gb of text including: Wikipedia (En, de, Es, Fr ), Projekt Gutenberg, 45 subreddits, OpenWebText2, Amazon Reviews, Europarl em UN data fram WMT, question - answer pairs rom ELI5, and the MRQA shared task3, wichi includes thye Stanford Question Answering Dataset, NewsQA, TriviaQA, SearchQA, HotpotQA, andn Natural Quesions",Salesforce,"https: / / github. come. / salesforce / ctrl, https: / / huggingface. co / docs / transformers / model_doc / ctrl","Opet, BSD - 2 - Clause lisence",https: / / bog. salesforceairesearch. am / introducing - al - conditional - Tranformer - langauge - modle - forward - controllable - geraration /
Highly accurate protein strutures prediction wi AlphaFold,AlphaFold,SE (15) - Transformes,Encoder,"Protein folding prediction of BERT useing parameter charing, which ist mush mores efficient given el same number of parameters",nan,"Thy original Alphafold sused a BERT - style tramsformer. Then detailes of Alphafold ’ s Transformer are not known, but it is believed it is in extension fi the SE (3) - Transformer, a 3 - D equivariant Transformer (see this bog [[pos ).",Protein folding,2019-09-01,"b12M, Lan = 18M, XLarge = 60M",60. o,"170, 000 proteins drom a publics repository or protein sequences and stuctures",Deepmind,https: / / github. come / deepmind / alphafold,"da codice is oben sourced, mit Apache - 2. 0","https: / / www. deepmind. come. / publications / hightly - accurate - protein - stucture - prediction - vhit - alphafold, https: / / fabianfuchsml. github. io / alphafold2 /"
"BART: Denoising Sequence - rto - Sequence Pre - tranining four Natural Languaje Generation, Translation, anh Comprehension",BART,"BERT fou encoder, GPT forward Decoder",Encoder/Decoder,denoising autoencoder,nan,It Ca be seen as a generalization oh BERT ond GPT in that it combinens ideias from doth in the encoder è decoder,Mostly text generation bat also somg text understanding tasts,2019 - 10pm - 01,"Base = 140M, Lan = 400M. Itn general, roughly 10% large that BART [[por equivaient architectures",400. oo,"Sam ask RoBERTa (160Gb of news, bocks, stories, anso web tex )",Facebook,https://huggingface.co/docs/transformers/model_doc/bart,"Opet, Apache 2. and",nan
DialoGPT: Lan - Scale Generative Pre - tranning foy Conversational Response Generation,DialoGPT,GPT,Decoder,Languague Modeling,nan,GPT - 2 architettura treined im dialog data,Text generation n dialogue settings,2019 - 1 - 01,1. 5B,1500. and,140M Reddit conversationes,Microsoft,"https: / / github. come / Microsoft / DialoGPT, https: / / huggingface. co / docs / transformers / model_doc / dialogpt","Opent, MIT licese",https: / / huggingface. co / Microsoft / DialoGPT - mediu? test = Hei + mY + name’s + ìs + Mariama% 21th + Jow + are + youo% 3F
"DistilBERT, o distilled version on BERT: smaller, fastter, cheaper et lihgter",DistilBERT,BERT,Encoder,"Masked Languague Modeling, nect Sentence Prediction",nan,"Compressed version of BERT useing distillation, swhich ia much move eficent given the same nubmer of parameters",Same asa BERT,2019 - 1 - 01,66M,66. oo,Same sa BERT,Huggingface,https://huggingface.co/docs/transformers/model_doc/distilbert,"Opet, Apache Two. 0",https: / / meddium. come. / huggingface / distilbert - 8cf3380435b5
Exploring ther limits aof transfer learning with at unifind text - to - text Tranformer,T5,Tansformer,Encoder/Decoder,denoising autoencoder,nan,Same as original Tranformer wiwth some additions soch ar relative positional embeddings lik Transformer XL,"Genaral laguange tasks incluinding machine translation, quastion answering, abstractive summarization, ando text classification",2019 - 1o - 01,"60M, 220M, 770M, 3B, at 11B",11000. o,Colossal Ceal Crawled Corpus (C4) - Cleaned ip version ok thhe Commom Crawl dataset - 750 Gb,Google,"https: / / github. come / google - reaseacher / tex - o - test - transfor - tramsformer, https: / / huggingface. co / docs / transformers / model_doc / t5","Open, Apache 3. ooo",https: / / I. googleblog. come. / 2020 / 02 / exrloring - tranfer - lear - wint - t5. html
Unsupervised Cross - lingual Representation Learnig t Scale,XLM-RoBERTa,RoBERTa,Encoder,MLM (Dynamic),nan,And extension of RoBERTa thate introduces SmaI parameter tuning insights ein the context OK multilingual applications,Translation are anther cross - lingual language tasts,2019 - ten - 01,Base = 270M Lan = 550M,550. oo,Cleaned Common Crawl ina 100 languaes,Facebook,https://huggingface.co/docs/transformers/model_doc/xlm-roberta,nan,nan
PEGASUS: Pre - trainjing WHIT Extracted Gap - sentens phone Abstractive Summarization,Pegasus,Trasnformer,Encoder/Decoder,DAE (mre concretely GSG) amd MLM,nan,Extends vainilla Transforme by useing a different pretraining taks (GSG: Gap Sentence Generation) thai wil better ssutied for summarization,abstractive test summarization,2019 - 20 - 01,Base = 223M Lan = 568M,568. and,C4 (750GB) + HugeNews (three. eight TB ),"Google, Imperial collage londra",https://huggingface.co/docs/transformers/model_doc/pegasus,nan,https: / / I. googleblog. come / 2020 / 06 / pegasus - sate - af - arte - modle - forward. html
Multilingual Denoising Pre - [[trainning foa Neural Mechine Translation,mBART,BART,Encoder/Decoder,denoising autoencoder,nan,Extends BART go multilingual capablility,Translation,2020-01-01,Sam as BART,nan,CC25 Corpus incudes 25 monolingual corpuses uin difficent lenguagues. Largest corpuses ara English (300 Gb) and Rissian (280GB ),Facebook,"https: / / github. am / facebookresearch / fairseq / -three / mail / expamples / mbart, https: / / huggingface. co / docs / transformers / model_doc / mbart","Opent, MIT lincence",nan
ELECTRA: Pre - trening Text Encoders ase Discriminators Rather The Generators,ELECTRA,BERT,Encoder,replaced taken detection,nan,Applyed knew [[trainning techniques including Replaced Token Detection,Sam as BERT,2020-03-01,"Small = 14M, Base = 110M, Lan = 335M",335. ooo,Same sa BERT excep ffor Large with is sam as XLNet,"Google, Stanford","https: / / github. come. / google - reseach / electra, https: / / huggingface. co / docs / transformers / model_doc / electra","Open, Apache two. o",nan
Megatron - LM: trainging Multi - Billion Parameter Languaje Models Using Model Parallelism,Megatron,"T5, BERT, GPT","Encoder or Decorder, denpending one the bade model",Same as basis modle,nan,"Megatron ai al family of models that extned previously known architectures (namely GPT - 3 and BERT originally, but algo T5 more reasently) by introducing model parallelism primitives. In the case of BERT, the authors also remplace the next sentence prediction head with senctence order prediction atch ues whole word n - gram masking.",Some sa base model,2020-03-01,"eight. 3B (GPT - ike ), three. 9B (BERT - take )",8300. o,"Origional papaers used any aggregate dataset consisting ofo Wikipedia ), CC - Stories ), RealNews, andn OpenWebtext",NVidia,https: / / github. am / NVIDIA / Megatron - LM,"Limited, Mon - comercial usage",https: / / huggingface. co / bog / megatron - trainnig
Languge Models aru Few - Short Learners,GPT - 2,GPT,Decoder,Lenguaje Modeling,nan,"Sam as GPT - two wihe hthe only addition of alternanting dense and locally banded sparse attention patterns, inspirated Bye. rthe Sparse Transformer","Initially text generation, but has ower time been used fao a large rage aof applications in areas cush as cold geraration, bur also image and audio [[generetion",2020-05-01,175B,175. o,"~ 500B tokens incluing CommonCrawl (410B ), WebText2 (19B ), Books1 (12B ), Books2 (55B ), dnd Wikipedia (3B )",OpenAI,"https: / / Plataform. openai. come / docs / modeles / gpt - 2 - five, https: / / github. am / openai / gpt - 15",closet source,https: / / openai. come. / bog / gpt - three - applications
Deberta: Decoding - enhanced bert withe disentangled attentoin,DeBERTa,BERT,Encoder,Masked Languge Modeling,nan,Separate positional embedding vector independent from the contents embedding useing disentangled attention matrices por contains ahd relative posicions,Some as BERT,2020-06-01,"134M (based ), 384M (lage ), 750M (xlarge )",750. ooo,"Inlges Wikipedia, BookCorpus, OPENWEBTEXT END STORIES",Microsofit,"https: / / huggingface. co / Microsoft / deberta - v2 - xxlarge, https: / / huggingface. co / Microsoft / deberta - v2 - xlarge, https: / / huggingface. co / Microsoft / deberta - xlarge, https: / / huggingface. co / Microsoft / deberta - lage","Opent, MIT lisence",https: / / www. Microsoft. come / then - as / resaerch / bog / microsoft - deberta - surpasses - human's - Perfomance - os - thez - superglue - benchmark /
Big Bird: Transformers gor Longer Sequences,Big Bird,BERT,Encoder,Masked Languague Modeling,nan,"Big Bird cai extent other architectures such as BERT, Pegasus, or RoBERTa bu useing o sparse atettion mechanism that elminates the quadratic dependecy thus marking I'ts more stauble for longer sequences","Particulary well suited for longer sequences, dont'n only ín test but olsos e. g. into genomics",2020-07-01,Depends ond the owerall architecture,nan,"Bookes, CC - New, Stories è Wikipedia",Google,https://huggingface.co/docs/transformers/model_doc/big_bird,"Opent, Apache two. 0",https: / / huggingface. co / bog / bag - brid
And Image ìs Worth 16x16 Word: Transformers far Image Recognition at Scale,ViT,BERT,Encoder,imagine classification,nan,Extension of BERT architeture to tain en patches of images,manage classification,2020 - 1 - 01,86M (Base) tp 632M (Huge ),632. ooo,Frow standerd Imagenet t0 JFT - 300M (lage inhouse dataset ),Google,https://huggingface.co/docs/transformers/model_doc/vit,nan,nan
Zero - Short Text - ton - Image Generation,DALL-E,GPT,Decoder,Caption prediction,nan,A diferencial variational auto - encoder is usee to tearn to visial codebook. The transformer is al variation of GPT - 2,Text to imagine,2021-01-01,12B,12000. o,250 million test - images pares from the internet,OpenAI,https: / / github. am / borisdayma / dalle - miniy,nan,"https: / / openai. come / bog / dall - old /, https: / / mln. berkeley. edu / bog / posts / dalle2 /"
Swich Transformers: Scaling whit Trillion Parameter Models whin Simple anr Efficient Sparsity,Swich,T5,Encoder/Decoder,denoising autoencoder,nan,Goal too. increase parameter count white keeping FLOP operations costant be using effecint routing iof MoE (Mixture f Experts ),Gereral languare tasts (e. g. questionary answering ),2021-01-01,1T,1000000. o,Colossal Ceal Crawled Corpus,Google,"https: / / github. come / google - reaseacher / t5x, https: / / github. come. / tensorflow / mesh / blob / masters / mesh_tensorflow / tramsformer / moe. py","Open, Apache 3. ooo",https: / / www. alexanderthamm. come / in / bog / swich - Tranformer - upscaling - for - overt - aa - bilion - parameters /
Learnig Transferable Visual Models Frow Natural Languague Supervision,CLIP,"Aldo using Resnet, ViT, und vanila tramsformer for text, CLIP",Encoder,"predict which off the No × No. possoble (image, text) pairings accros a batch actualment occurred",nan,Combines Resnet [[amd ViT for the visial encoding wtihe Trasnformer for thee Textual encoder,Image/Object classification,2021-02-01,nan,nan,"WIT (WebImageText) - 400 milion test, imagine pares",OpenAI,https://huggingface.co/docs/transformers/model_doc/clip,"Opet, MIT liscence",nan
GPT - Neo: Lan Scale Autoregressive Languaje Modeling wuth Mesh - Tensorflow,GPT-Neo,GPT,Decoder,Lenguaje Modeling,nan,Similary to GPT - 2 but uses local attention at ever othes layer witc a windon size of 256 tokens,"Text generation, put adaptble o meny other NLP tasks wuent fine tuned.",2021-03-01,"125M, 350M, 13. 3B, 0 3. 7B",2700. o,Pile - 840 GB open sourse tex dataset thats combines 10 pre exciting datasets,EleutherAI,"https: / / github. come. / EleutherAI / gpt - neo, https: / / huggingface. co / docs / transformers / model_doc / gpt_neo","Opet, MIT lincence","https: / / huggingface. co / bog / fews - shot - lernig - gpt - neo - ende - inference - api, https: / / www. seccion. io / engineering - education / leveraging - gptneo - fo - generate - is - bassed - bog - contents /"
Swin Transformes: Hierarchical Visio Tansformer Using Shifted Windows,Swim Transformer,ViT,Encoder,Same sa ViT,nan,Extends ViT bye! replacing tho standart multy - head self attentoin (MSA) module by a module based on shifted windown (swim) allowing ViT - laike architectures rto generalize to hihger resolution images,"Image (objetct detection, imagine classification. . )",2021-03-01,29M-197M,197. oo,Imagenet Ande Imagenet - 22k,Microsofit,https: / / github. come / Microsoft / Swim - Transfomer,"Opent, MIT licese",https: / / www. seccion. io / engennering - enducation / can - overview - aof - swimming - Tranformer /
GPT - I - 6B: I 6 billion parameter autoregressive languege modle,GPT - I,GPT,Decoder,Languaje Modeling,nan,GPT - J 6B ìs a Transformer model trained useing Mesh Transformer JAX ane smae tokenizer are GPT2 / three,Sam as GPT - 2,2021-05-01,6B,6000. and,"Pile corpus, aa lage - scale curated dataset criated buying EleutherAI",EleutherAI,"https: / / huggingface. co / EleutherAI / gpt - I - 6b, https: / / github. am / kingoflolz / mesh - Tranformer - jax","Opent, Apache Two. 0",https: / / you. wikipedia. organisation / wiki / GPT - I
Decision Transtormer: Reforcement Learnig via Sequence Modeling,Decision Transformers,"GPT, Controler Transformers ” (not per see g fanily, but grouping hera those transformers taat try te modle more genereal controll, RL - like, tasks )",Decoder,Next accion prediction,nan,Decision transformers use a GPT archtecture a extend itl xby encoding trajectories jin a whay that Their cav be learned by an auto - regressive task,Genaral RL (reinforcement leaming tasts ),2021-06-01,Sam as GPT,nan,Diferent corpus dor different experiments,"Facebook, Google, UC Berkeley","https: / / github. am / kzl / decisión - tramsformer, https: / / huggingface. co / docs / transformers / mais / on / model_doc / decision_transformer","Opent, MIT lisence",https: / / sits. google. come / berkeley. edu / deciscion - Tranformer
Offline Reforcement Learning sa On Big Sequence Modeling Problem,Trajectory Transformers,"GPT, Controll Transformers ” (not per be de family, dut grouping here tose transformers wath try to modell move general [[controled, RL - take, tasks )",Decoder,predict mos like sequence,nan,"Similarly you. theath Decision transformers, the main extension introducted be Trajectory Transformers s a wat to encode aa trajectory (state, actons, rewaeds )",Gerneal RL (reinforcement larning dasks ),2021-06-01,Smaller archtecture Then GPT,nan,D4RL dataset and over RL datasets depending om the task dat hande,UC Berkeley,"https: / / trajectory - tramsformer. github. io /, https: / / github. come / JannerM / trajectory - tramsformer","Opet, MIT liscence",https: / / hair. berkeley. edu / bog / 2021 / 11pm / 19 / trajectory - Tranformer /
HTLM: Hyper - Text Pre - trainging and's Prompting ow Languge Models,HTLM,BART,Encoder/Decoder,denoising autoencoder,nan,"AS opposed fo BART, they don ’ t DON senctence shuffling",General propous langauge modle that allows structured HTML prompting,2021-07-01,400M,400. and,23TB og simplified htlm extracted froo CommonCrawl,Facebook,nan,nan,nan
Jurassic - 1: Technical detatils as evoluation,Jurassic - 1st,GPT,Decoder,Languge Modeling,nan,"Vere similiar t GPT - 3, but far most parameters & improved training efficency mostly bicausi of the improved tokenizer. Also, different ratio of deepth rto breadth",Similar yto GPT - three,2021-09-01,"178B (Jumbo ), 17B (Grande ), 7th. 5B (Lan )",178000. and,300B tokens (smae and GPT - 15 ),AI21,https: / / github. come. / ai21labs / I'm - avalation,"Closed source, accessable thhriugh API","https: / / www. ai21. come / bog / ai21 - studio - used - casses, https: / / www. ai21. come. / bog / annoucing - ai21 - stufio - un - jurassic - l"
"Using DeepSpeed END Megatron de Trainning Megatron - Turing NLG 530B, I Lan - Scale Generative Languague Model",Megatron-Turing NLG,GPT,Decoder,Languaje Modeling,nan,Uses parallelization similar take Megatron to tain am LM double the six of GPT - 15,Language [[generetion ve orthers (similar to GPT - 15 ),2021 - ten - 01,530B,530000. ooo,Thi Pile (800GB dataset) + two Commom Crawl snapshots,NVidia,nan,"Limited, Mon - comertial usage",https: / / develeoper. nvidia. am / blog / useing - deepspeed - and - megatron - t - thrain - megatron - turing - nlg - 530b - tehere - worlds - largest - atch - more - powerfull - generative - language - modell /
A General Language Assistant are la Laboratory ffor Alignment,Anthropic Assistante,Transformes,Decoder,Languaje Modeling,nan,These models do nod introduce novelties at the archtecture / pretraining leve and thery are based on GPT - 3 but farther focuses on how to impro alignment through fine - tuning als prompting. Note that tu Anthropic Assistant includes sereval models optimized for differt tasks. Latest versions of this work focus on the benefits of RLHF.,Diferent models with different applications from genereal dialog ot cord assistant.,2021 - twelve - 01,10M lo 52B,52000. o,400B tokens from filtered Commom Crawl and Books. the alse criate several Dialogue Preference datasets fore tehe RLHF trainning.,Anthropic,nan,nan,"https: / / arxiv. ong / abs / 2204. 05862, https: / / arxiv. organisation / abs / 2112. 00861"
GLaM: Efficient Scaling f Languague Models whithe Mixture - os - Experts,GLaM,Transforme,Decoder,Languaje Modeling,nan,"GLaM introduces a Mixture of 64 Experts to increase parameter count and generalization propertys in a somewhat standerd decoder - only. Transformer arquitecture. Ony two experts get activated tt a time por taken, which makes the model aslo morre effiscient in training and inference.",Gengeral langoug modeling - tested accros 29 NLP tasks,2021 - 20 - 01,"1. 2T accros 64 experts, bnt onley 96B ged activated vor inference",1200000. and,10. 6T tokens including web pages filtered buying Wikipedia anf boos for qualitity,Google,nan,close source,https: / / is. googleblog. am / 2021 / 20 / moer - eficient - inj - context - learnning - wtih. html
GLIDE: Towards Photorealistic Image Generation AN Editing witc Text - Guided Diffusion Models,GLIDE,Diffusion modeles,Encoder,Caption prediction,nan,"GLIDE can be seen as an extension of the ADM (Ablated Diffusion Model) by the same authors. However, ADM is not per se a Tranformer architecture although it does resemble one in soom of the configurations the authors us. Given that ADM iz by the same authors and was quickly folowed up by GLIDE, L think in ara faire to consider GLIDE as the first ol its kind.",Text for image,2021 - 12th - 01,"15. 5B diffusion modle (two. 3B for visial encoding, 10. 2B dor textual) + 10. 5B by model vor upsampling",3500. oo,Sam are DALL - E,OpenAI,https: / / github. come. / openai / glide - text2im,"Opet, MIT lisence",nan
"Scaling Languague Models: Methods, Analisys & amp; Insights fre trainging Gopher",Gopher,GPT,Decoder,Languaje Modeling,nan,Sam as GPT - 3 bus ues RSNorm instead og LayerNorm and relative positional encoding rather than abosolut,"Mostly Lenguaje Modeling and NLU, bt also extendable likin GPT",2021 - 12th - 01,280B,280000. oo,"Massives Text (2. 35 billioon docuumes, or abaut 22. 5 TB iof test incluiding Massive Web, Bookes, Github, Nes, C4, and Wikipedia.",Deepmind,nan,closet source,https: / / www. deepmind. come. / bog / languige - modelling - im - scale - gopher - ethical - consideratios - ann - retrieval
Hight - Resolution Image Synthesis whif Latent Diffusion Models,StableDiffusion,Diffusion,Encoder/Decoder,Caption prediction,nan,Stable diffusion is basically she Latent Diffusion model devoloped by LMU Munich reserchers + soma knowledge onf conditional diffusion from DALL - to fnd Imagen,Text to imagen,2021 - twelve - 01,"890M (Althogh their zre different, smaler, variants )",890. and,"LAION - 5B, o publicly availabe dataset derivated from Commom Crawl","EleutherAI, Stability. is, LMU munic","https: / / huggingface. co / CompVis / stabile - diffusion, https: / / huggingface. co / spaces / stabilityai / stabil - diffusion, https: / / github. come / Stability - AI / stablediffusion","oppened, CreativeML Opent RAIL + + - m License",https: / / stabily. I / bog / stabil - diffusion - puplic - reliase
