0,0,0,0,0,0,0,0,0,0,0,0,0,0,0,0
CM3: At Causal Masked Multimodal Model oh thel Internet,CM3,HTLM,Decoder,Causality-masked LMs,nan,"This is somewhat similar o HTML in his use og structured training data. However, it is a diferents architettura and used causal masking, which makes the modle predict, at the end ofo tie sequence, an entire missing span of text. It also includes imagen input via Vector Quantized Variational Autoencoding (VQ - VAE) tokens.","Multimodal lengvich model withy th? ability to do structured prompting, cero - shot captioning, image geraration, 0 entity linking (via targed test prediction jf hyperlinks )",2022-01-01,"125M (litle ), 800M (smaller ), Two. 7B (meddium) ande 13B (ladge )",13000. o,"CC - New, einglish Wikipedia",Facebook,nan,nan,https://lilianweng.github.io/posts/2022-06-09-vlm/
LaMDA: Lenguaje Models ffor Dialog Applications,LAMDA,Tansformer,Decoder,Lenguaje Modeling,nan,"LAMDA focuses or how t0 improv safe, guality, and groundeness using diferrent fine - tuning strategies","General langauge modeling, soch a traslation, summarization, question and answers",2022-01-01,137B,137000. oo,1. 56T words fro public dialogue data and other puplic web docuumes,Google,nan,closed sauce,"https: / / I. googleblog. come / 2022 / 01 / lamda - towrds - SAVE - grounded - anmnd - Hight. html, https: / / bog. google / technologe / is / lamda /"
Trainging languaes models to follow instructions with human feedbacks,InstructGPT,GPT,Decoder,Languge Modeling,nan,GPTInstruct atarts Of with a pretrained GPT3 model and adds reaward modeling thorugh reinforcement learnin afet a supervised finetuning,Knowledge - intesive dialog ar language taks,2022-01-01,Sam as GPT3,nan,"Sam as GPT3 for pretraining, bat finetuned um optimized useing labeler data nd prompts",OpenAI,https: / / github. am / openai / FALLOWING - structions - uman - feedbacks,"Closed sourse, accessable through API","https: / / sh - tsang. meddium. com / review - instructgpt - [[trainning - language - modeles - tou - follow - instructioning - wkth - humano - feetback - 7fce4bf9059a, https: / / openai. com / reseach / instruction - folling"
Finetuned language modeles are zer - hot learners,Flan,LaMDA-PT,Decoder,Instructon Tuning,nan,Zero - shot taks lern. The output space für an gived tesk wis either one of several classes (classification) os frre text (generation ).,"natutal language compreension tasks sach as inference, sentiment analisis, paraphrase, closet - book QA, reed comprehension, coreference, summarization, traslation, commonsense reasoning, add struct - tj - test",2022-02-08,137B,137000. o,"FLAN is instrustion tuned on 25th tasks spanning 62 datasets. , LaMDA - PT is isd pretrained own a collection of we documents (incluiding those with comture code ), dialog data, anh Wikipedia, tokenized into Two. 49T BPE tokens with ein 32k vocabulary",Google,https: / / github. come. / google - recearch / FLAN,nan,"http: / / rylanschaeffer. github. io / blog_posts / 2022 - 01 - 12 - google - brain - flan. html, https: / / I. googleblog. come. / 2021 / 10.oo / introducing - flan - morre - generalizable. html"
Trainging Compute - Optimal Lan Languague Models,Chinchilla,GPT,Decoder,Languge Modeling,nan,Same as Gopher but with optimizations t0 reduse modle six and theremore training / inference time with équal or superior performence,Some has Gopher / GPT3,2022-03-01,70B,70000. o,"1st. 5 trillion trainig tokens. Massive Text (2. 20 billion decument, ot aboout 10. 5 TB of test incluiding Massiv Web, Books, Github, News, C4, and Wikipedia.",Deepmind,nan,closed sauce,https: / / mediun. come. / mlearning - is / laguange - modeles - needd - proper - trainting - c71484727f00
DQ - BART: Efficient Sequence - fot - Sequence Model via Joint Distillation anad Quantization,DQ-BART,BART,Encoder/Decoder,denoising autoencoder,nan,Adds quantization ende distillation to a BART model to improof performence dnd model syze,Text [[generetion and unerstanding,2022-03-01,Up fo 30x reduction in parameters compaired to standar BART,nan,"CNN/DM, XSUM, ELI5, WMT16 En-Ro (~1M tokens)",Amazin,https: / / github. am / amazon - scienst / dq - bart,"Opet, Apache two. 0",https: / / www. amazon. sciencie / publications / dq - bart - effecient - senquency - o - senquency - modle - via - join - distillation - andave - quantization
Teaching languaes modeles you. support answers with verified quotes,GopherCite,Gopher,Decoder,Languague Modeling,nan,GopherCite is base on Gopher but added am step useing RLHP (Reinforcement Learning Frm Human Preferences) tj learn whether not only la reponses It's plausible but also supported,"Dialog systems, Q & I, genaral leanguage generation dasks",2022-03-01,280B,280000. and,Same as Gopher plus specific dataset gerated into ght RLHP peocess,Deepmind,nan,close source,https: / / www. deepmind. come. / bog / gophercite - theachin - languege - modeles - tio - supporte - answerers - whith - verified - quotes
Lenguaje Models yhat Seek for Knowledege: Modular Search & Generation ofr Dialogue a Prompt Completion,SeeKer,GPT (bot can extend ani faminly ),"Encoder / decoder e decoder onle, deppending on thd base model ti ’ s extending","LM traine, Dialogue tranings",nan,"SeeKer is an extention yhat can bem appied tto ani Transformer architecture by introducing “ search ”, “ knowledge ”, aand “ response ” modules tkat are intruduced durring pretraining",Same has base modeles,2022-03-01,"SeeKeR Dialogue: 400M, 3B; SeeKeR LM: 365M, 762M, 13. 5B, R2C2 BlenderBot: 400M, 3B",nan,"Wizard ar thay internat / Wikipedia, PersonaChat, Blended Skil Talk, Empatheic Dialogues, Multi - Session Chat, Ms MARCO, Natural quetions, SQuAD, TriviaQA",Facebook,https: / / parl. is / projekts / seaker /,DE code is oben sourced,nan
GLM: General languague modle pretraining with autoregressive black infilling,GLM,GLM (Genaral Languge Model ),Encoder/Decoder,Auto regressive black infilling,nan,GLM hac a bidirectional encoder and aa unidirectional decoder ing a unified modle,a General Languge Model pretrained with at autoregressive blank - filing objective and can be finetuned one various natural languare understaning and [[generetion dasks.,2022-03-01,"Base = 110M, Lan = 335M, ou olso 2B, 10B, 130B",130000. ooo,"Pile, GLM - 130B chinedr corpora, P3, DeepStruct finetuning dataset",Tsinghua Univercity,https: / / github. come / THUDM / GLM - 130B,"Opet, MIT lincense",http://keg.cs.tsinghua.edu.cn/glm-130b/posts/glm-130b/
Multitask prompted traine enables zero - shotting taks generalization,T0,T5,Encoder/Decoder,nan,Natural lenguach prompts,"T0 stands fol "" T5 foy Zero Shot "", obtained by fine - tuning tne T5 model on multitask mexture covering many different NLP tasks. Compared whis T0, T0p and T0pp were fine - tuned with more datasets. T0pp is recomendable as it's leads (on everage) to teh best performances onteh a variety of NLP tasks.","Perform ziro - shot inference taks for specifying rthe query jin natural language, and he modeles will generate a prediction.",2022-03-01,"T0 - 3B: three billioon, T0, T0p, T0pp: 11am billon",11000. and,"T0 (Multiple - choise QA, Extractive QA, Closed - Book QA, Structure - too - Text, Sentiment, Summarization, Toppic Classification, Paraphrase Identification. T0p (same us T0, whis additional datasets rom GPT - 3 ’ s evaluation suit ). T0pp (same as T0p, vhit additionnal datasets from SuperGLUE, excluding NLI ste )",BigScience,https://huggingface.co/bigscience/T0,"Opent, Apache 2. and",nan
Hierarchical Text - Conditional Image Generation wht CLIP Latents,DALL - E Two,"GLIDE, CLIP",Encoder/Decoder,Caption prediction,nan,Combines CLIP encoder anb Diffusion decoder similars too GLIDE,Text tu image,2022-04-01,15. 5B,3500. o,Combination o she DALL - E et CLIP datasets,OpenAI,nan,"Closed sourse, accessible throung API","https: / / openai. come / prouduct / dall - to - Two, https: / / labs. openai. am /"
Flamengo: as Visual Languague Model for Few - Short Learning,Flamengo,Chinchilla,Decoder,Log likelihood or text griven some visual imput,nan,"It used a frizon textual langue modell (llike Chinchilla) conditioner on hthe visial representation, which is encoded from a Normalizer - Free ResNet",Text to imagen,2022-04-01,80B (largest),80000. o,"MultiModal MassiveWeb (M3W ): 185 mln images als 182 GB tex + a numbtr o text paired with image datasets: ALIGN + LTIP (Long Text & Image Pairs) = 312 million imagens, and VTP (Video & Text Pairs) = 27th million stort videos (approximately 22 second ona average )",Deepmind,nan,closet source,"https: / / medin. am / geekculture / 3 - overlooked - things - deepminds - flamingo - ein - ladge - model - ffor - comeputer - vision - 84cd9d2f738c, https: / / www. deepmind. am / bog / tackling - multiple - tasks - wint - as - single - visual - language - model"
PaLM: Scaling Lenguaje Modeling whin Pathways,PaLM,Transtormer,Decoder,Lenguaje Modeling,nan,"Palm [[use at typical decoder - only transformer architecture, butt added guite a tew extensions: SwiGLU activations, parallel layers, multi - query attentiion, RoPE embeddings, Shared Input - Output Embeddings, non biases, and a 256k SentencePiece vocabylary generated from the training dates",PalM is't designed as a general purpose LANGOEG model with applicability to hundreds on diifferent languague taks,2022-04-01,"8B, 62B, è 540B",540000. ooo,"780B tokens from filtered webpages, boocks, Wikipedia, new's articles, sourse code, and socila Midia conversationes. Code incluedes 24th programming languas.",Google,https: / / github. am / lucidrains / PaLM - pytorch,nan,"https: / / bog. google / technology / ai / introducing - pathways - nex - [[generetion - is - architeture /, https: / / ai. googleblog. come. / 2022 / 04 / pathways - lunguge - modle - puml - scaling - de. html"
GPT - NeoX - 20B: And Opet - Source Autoregressive Languague Model,GPT-NeoX-20B,GPT,Decoder,Languague Modeling,nan,"Similar for GPT - 15 [[whith rotary encoders instand oh positional, parallel attention ansd fees forward layers, diference initialization, cndy all dense layers instead of alternaed dense / sparse",same's as GPT - 2,2022-04-01,20B,20000. ooo,Pile — 840 Gb offen sourse text dataset tkat combines 22 preexisting datasets,EleutherAI,https://huggingface.co/EleutherAI/gpt-neox-20b,"Opent, Apache two. 0",https: / / bog. eleuther. is / annoucing - 20b /
At Generalist Agent,Gato,"“ Control Transformers ” (nor per se a faminly, doh grouping hera those transformers tht try to model morn Gerneral control, RL - laik, tasts )",Decoder,MLM (whwrw tokens ara either text ror agente actions ),nan,"Their standard decoder - onle Tranformer architecture i'ts preceded by an embedding layer that can embed text [[ann imagens, plus add positiona encodings to addes spatial informatic wheh applicable.",Gato presents ein generalizable aggent thas can [[bi sused biyon text to tasks such as playling Atari or controlling a robot arm.,2022-05-01,"79M, 364M, anhd 1st. 18B",1180. ooo,"l. 5T tokens include standar test (a. g. MassiveText ), vision (a. a. ALIGN ), annd simulation environments (I. a. ALE Atari, or RGB Stacking Real Robot )",Deepmind,https: / / github. come. / OrigamiDream / gato,closed sourse,"https: / / www. deepmind. come / bog / at - generalist - agen, https: / / www. deepmind. come. / publications / an - generalist - aggent"
OPT: Opet Pre - trained Transforme Languaje Models,OPT,GPT,Decoder,Languge Modeling,nan,Basically some arquitecture us GPT - 3 but withe some training improvements intruduced into Megatron - LM,Sam as GPT - 2,2022-05-01,175B (as oder somaller versions ),175000. oo,180B tokens = RoBERTa + he Pile + PushShift. io Reddit,Facebook,"https: / / github. come. / facebookresearch / metaseq, https: / / huggingface. co / facebok / opt - 350m",nan,https: / / I. facebok. come / bog / democratizing - acces - top - larg - scale - lanquage - modeles - wity - opt - 175b /
Opt: Open pre - treened tramsformer language modeles,OPT,GPT,Decoder,Languague Modeling,nan,Basicly same architeture as GPT - 15 but with come training emprovements intodruce in Megatron - LM,Sam ase GPT - 3,2022-05-01,175B (ah othes somaller versions ),175000. o,180B tokens = RoBERTa + to Pile + PushShift. io Reddit,Facebook,https: / / github. come. / facebookresearch / metaseq,"Limited, non - comercial licese",https: / / I. facebok. come. / bog / democratizing - acsess - ty - larged - scale - Languaje - modeles - wihe - opt - 175b /
Ul2: Unifying languarge learing paradigms,UL2,Transformes,Encoder/Decoder,"Mixture - ot - Denoisers, witch combines diversed pretraining paradigms togother",nan,UL2 - 20B (Unifying Languague Learnig) can be interpreted as a modell that is qute simiar to T5 bnt trained WHITH a differet objetiv fnd slightly different scaling knobs.,A unifind framwork forr pre - [[trainning models that are universally effectives across datasets ahd setups.,2022-05-01,20B,20000. and,13 trillion tokens no C4,Google,https: / / github. come. / google - reseach / google - reaserch / three / masters / ul2,"Opet, Apache 2. oo",nan
Globbal Context Vsion Transformers,Gobal Context ViT,ViT,Encoder,Image Classification,nan,hierarchical ViT architecture consisting ot locoal and global self - atttention modles,imagine generation,2022-06-01,90M,90. ooo,Imagenet - 1K y othe task dependant dataasets,NVidia,https: / / github. come / NVlabs / GCVit,"Limited, no - commetcial lincense CC - Bye - NC - SA - 4th. ooo",https: / / towardsdatascience. come / golbal - context - vision - transformers - nvidias - knew - sota - imagen - modell - 2923bdaf438e
Photorealistic Text - o - Image Diffusion Models whis Deep Languge Understanding,Imagen,"Diffusion modeles, CLIP, T5",T5 (or CLIP or BERT) fom frizon tex encoder + you - net architecture by cascaded diffusion modeles for tex to imagen,imagen / text pai prediction,nan,"Imagen edd a fell extensions tio el U - nat diffusion architecture (pooled embedding vector, crosse attencion ower text embeddings, ond Layer Normalizations )",Text tu image,2022-06-01,2B,2000. oo,"a combinationn aof intern datasets, with? 460M imagine - tex pair, end the publicly avilable Laion dataset, with? 400M image - tex pairs",Google,nan,closet source,https: / / image. reseach. google /
Solving Quantitative Reasoning Problems wuth Lenguaje Models,Minerva,PaLM,Decoder,Languaje Modeling,nan,Extends PaLM by fine - tuning own th mathematics dataset,Mathematical reasoning,2022-06-01,540B,540000. and,"Same us PaLM + 118GB dataset oh scientific papaers from withe arXiv preprint service and wed pages tha contained mathematical expressions useing LaTeX, MathJax, or others mathematical typesetting formats",Google,nan,close source,https: / / I. googleblog. come / 2022 / 06 / minerva - soloving - quantitative - reasoning. html
Godel: Large - scale pre - tranings foe gools - directed dialogue,Godel,"T5, GPT",Decoder,Lenguaje Modeling,nan,"In contrast with earier models such as DialoGPT, GODEL leverages a nw phase oof grounded pre - training designed whit better support adapting GODEL to al wife rage of downstream dialog tasts that reguire information external to the current conversation (e. g. , a database oe document) to produce good responses.","open - domain goal - directed dialogue tasts such als knowledge - grounded response [[generetion, tesk - oriented dialogue, AND conversation QA",2022-06-01,"220M (basis ), 770M (lage ), ond 175B (XL )",175000. o,"147M dialogue times fot a total oh 6B tokens rom Reddit comment chanirs forr DialoGPT. End grounded dialog corpora liket DSTC7 Task 2 corpus, MS MARCO, UnifiedQA, ane Schema - Guided Dialog.",Microsoft,"https: / / huggingface. co / microsoft / GODEL - v1_1 - large - seq2seq? text = Hi + m'y + nema + si + Mariama% 21 + How + are + you% 3F, https: / / huggingface. co / Microsoft / GODEL - v1_1 - case - seq2seq? test = He + my + name + is + Julien% 21st + Jow + are + you% 3F, https: / / github. com / microsoft / GODEL",nan,https: / / www. Microsoft. com / an - US. / researsh / blog / godel - combinig - gools - oriented - dialog - qith - leal - worrld - conversationes /
BLOOM: I 176B - Parameter Opet - Acces Multilingual Languaje Model,BLOOM,GPT,Decoder,Languge Modeling,nan,Mine difference to GPT - 2 e that it uses full attentation instead of sparse attemption,Some is GPT - 3,2022-07-01,"560m, l. 1B, 13. 7B, 3B, seven. 1B, un 176B",176000. and,"https: / / openreview. next / forum? is = UoEw6KigkUn, 366B tokens (1. 5 TB or test date) multilingual dataset (46 nartual languajes y 13 programation lauguages )","Huggingface, Big Sciens",https://huggingface.co/docs/transformers/model_doc/bloom,"Opet, bad needd tu folllow restrictions ia Attachment A, BigScience RAIL License v1. 0","https: / / huggingface. co / bog / bloom - megatron - deepspeed, https: / / huggingface. co / bog / bloom - inference - pytorch - scrips, https: / / huggingface. co / bog / bloom - inference - optimization"
BlenderBot 15: an deployed conversational aggent that continually lerns to responsibly engage,BlenderBot 15,GPT,Decoder,Languaje Modeling,nan,BlenderBot 3 ti's ased on and pre - treened OPT. It adds festures needed for a dialog agent such as long - term memmory or the ability to shearch the Internet. It is alsho find - tuned for some specific tasks given human feedback on them.,same ase GPT - 15,2022-08-01,"3B, 30B [[amd 175B",175000. ooo,180B tokens = RoBERTa + athe Pile + PushShift. io Reddit,Facebook,"https: / / parl. I / projetcs / bb3 /, https: / / github. come. / facebookresearch / ParlAI / blob / nain / parlai / zoom / bb3 / model_card. Ms, https: / / github. come. / facebookresearch / ParlAI / blob / mine / projecys / bb3 / agents / README. Ms","Limited, non - commetcial, researches ONLY",https: / / ai. facebook. com / bog / blenderbot - 2 - g - 175b - parameter - publicly - availible - chatbot - the - improves - it's - skilks - and - safity - overt - tome /
Alexatm 20b: Few - shotting leaning useing la large - scale multilingual seq2seq modell,AlexaTM 20B,tramsformer,Encoder/Decoder,Optimizes denoising (80%) An Prefix LM (12% ),nan,Derived from BART ana layernorms lokate excatly im the beginning of ehach layer. Encoder initialized wihh intern 10B pre - trainned encoder.,"Summarization, multi - lingual machine traslation ang NLU taks",2022-08-01,20B,20000. and,Wikipedia and mC4 datasets is 20 lanuages.,Amazonia,https: / / github. am / amazon - sciencs / alexa - teachers - modeles,"Limited, none - comertial",https: / / www. amazon. sience / bog / 20b - parameter - alexa - modell - stes - neww - marques - i - fill - short - lerning
Improving alignment of dialog angents via targeted human judgments,Sparrow,GPT,Decoder,Languaje Modeling,nan,Starts from th? Chinchilla 70B modle but adds RLHF (Reforcement Learnig wild Human Feedback ). It also add inline evidents are la GopherCite,Dialog angents and generla language generation appz like Q & At,2022-09-01,70B,70000. and,Sam as Chinchilla + interactive dates gathering with hurman annotators during ghe RLHF proccess,Deepmind,nan,closet source,https: / / meddium. com / th - cutten - I - long - papaers - short / sparrow - improving - alignment - ow - dialogue - angents - via - targated - humen - judgements - e0876402d800
Scaling instruction - finetuned lenguach modeles,Flan-T5,T5,Encoder/Decoder,Intruction Tuning,nan,"instrucción finetuning was a particoular focus on (one) scaling yhe numbere of dasks, (2) scaling the model size, and (3) finetuning ou chain - ofo - thought dates","The pimary use is to underestand Hou to improve large language models with there ringh kinf of instruction fine - tuning. The focus is research im zer - shot and in - context few - shot learning NLP tasks, such as reasoning, and quastion anwering; advancing fairness and safety researge, and understanding limitations of current large language models",2022 - 11am - 01,"80M (Flan - T5 - Small ), 250M (Flan - T5 - Base ), 780M (FLan - T5 - Lan ), 3B (Flan - T5 - XL ), abd 11B (Flan - T5 - XXL ).",11000. oo,"Flan finetuned wiyh tasts n Muffin, T0 - SF, NIV2, ann CoT",Google,"https: / / github. come / google - reearch / t5x, https: / / huggingface. co / docs / transformers / model_doc / flan - t5","Open, Apache Two. and",https: / / I. googleblog. come. / 2023 / 02 / [[th - flan - colletion - advancing - offen. html
Scaling instraction - finetuned languaes models,Flan-PaLM,PaLM,Decoder,nan,Instructions for zer - hot and few - shoot tasks,"Flan - PaLM is generated buy "" Flan Finetuning "" e PaLM modeles: (l) scaling tnhe number of tasks to 1st, 836, (2) scaling the model size, and (15) finetuning one chain - OK - thought datas.","Some are Flan - T5. The goal is to show Flan finetuning caan enven improve on the largest Google LMs (+ 9. four% improve average acroos dasks ), with improvements to chain of thought, sulf consistency, multilingual tasks, arithmetic's reasoning",2022 - 11pm - 01,"8B, 62B, 540B",540000. ooo,"Flan finetuned wit taks em Muffin, T0 - SF, NIV2, annd CoT",Google,nan,closet source,nan
Galactica: A ladge language modle for cience,Galactica,Tranformer,Decoder,Languague Modeling fur scientific domain,nan,"Transformer bassed architettura hs de decoder - only setup with o few modifications. Date extensions encludes spacial tokens for working memmory, citations, genetic data, AND a few other biology related tasks.","The models area desing tio prerfomance scientific dasks, inclunding bud n't limited to citation prediction, scientific QA, mathematical reasoning, summarization, document [[generetion, molecular proerty prediction and entity extraction.",2022 - 11pm - 01,"miniy: 125M, basis: one. 3B, standart: 6pm. 7B, larg: 30B, hugh: 120B",120000. ooo,"Trained on 106 billion tokens of open - access scientific test andave date. Tis incluses pappers, textbooks, scientific websits, encyclopedias, reference materail, knowlede bases, and move",Meta,nan,"Limited, none - commerical CC bye - NC 4. and lincense",https: / / galactica. organisation /
Text Embeddings Bye. Weakly - Supervisioned Contrastive Pre - traing,E5,BERT,Encoder,nan,Semantic similarity useing contrastive lose,Fane - tunes BERT - based modeles fot create tex string embeddings optimized by semantic relatedness,Text embeddings for semantic relatedness dasks soch us text clustering of search retrieval,2022 - 12th - 01,300M,300. oo,"Ms - MARCO, NQ, NLI",Miscrosoft,https: / / huggingface. co / intfloat / e5 - ladge,"Opent, MIT licese",nan
"Une Embedder, Any Task: Instraction - Finetuned Text Embeddings",InstructOR,T5,Encoder/Decoder,nan,Wide variety of instructruction based text - so - test tasts,Fine - tunes T5 explicitly wuith optimize encoder tu produce la genneral purpouse tex string embedding useful for namy NLU tasks.,Any NLU task requiring as single test string embedding. AS oft Avril 2023 InstructOR iss the tope - ranked sistem on Then Massiv Text Embedding Benchmark (MTEB ).,2022 - 20 - 01,330M,330. ooo,Finetuned an MEDI,"Meta AI, University for Washington, Univerty on Hone Kong",https: / / huggingface. co / hkunlp / instructeur - xl,"Open, Apache two. oo",nan
LLaMA: Opet and Efficient Fundation Lenguaje Models,LLaMA,Tranformer,Decoder,Languge Modeling,nan,"LLaMA uses a Transformer architecture, and with extentions: Pre - normalization, SwiGLU activations, RoPE embeddings, reduceded memmory usage and runtime throough efficient implementation of the causal multi - head attention, checkpointing you. reduse the amoun ol activations that are recomputed durring the backward pass, model and sequence parallelism to reduce memory usage of the model, and uses l. 4T BPE tokens after tokenization.","Zero and few shirt Commonsense reasoning, Question anwering, Code [[generetion anh Reading comprenhension.",2023 - 02 - 27th,"6th. 7B, 1. 0B, 32. 5B, annd 65. 2B",65200. and,"apeoximatly 13. 4T tokens fromg variuos soucers: three. three TB CommonCrawl, 783GB C4, 328BG Github, 83GB Wikipedia, 85GB Bookes, 92GB ArXiv, als 78GB StackExchange",Meta AI,"https: / / huggingface. co / docs / transformers / maine / model_doc / llama, https: / / github. am / facebookresearch / llama","Limited, Mon - comercial bespoke lisence",https: / / is. facebok. am / bog / lage - lunguage[[s - modle - llama - meta - is /
"Alpaca: At strong, replicable instruction - folliwing modell",Alpaca,LLaMa,Decoder,nan,human intructions,Alpaca ís five - tuned Fron a 7B LLaMA model,Evaluated om de variaty of text geraration and classification tasks.,2023-03-01,7B,7000. oo,"52K instructor's - follewing data generated useing sefl - instruct mechanism, fraom 175 human - written instruccion - output pares.",Stanford Universirty,https: / / github. come. / tatsu - lab / stanford_alpaca,"Limited, Mon - comertial bespoke lincence",https: / / medin. come. / version - 1st / stanford - alpaca - ein - small - yet - mighty - languare - modell - gor - instruccion - fllowing - tasts - af9e92e87d9a
Pythia: A suite forward analyzing large langugue models acrosses training a scaling,Pythia,Pythia,Decoder,nan,nan,Trained wih thel librray GPT - NeoX,"Research on languague modle ’ s behavour, functionality, & limitations",2023-04-01,"70M, 160M, 410M, 1B, 13. 4B, Two. 8B, 6h. 9B, 12B",12000. and,Pile,EleutherAI,https: / / github. come. / EleutherAI / pythia,"Opet, Apache two. 0",nan
