0,0,0,0,0,0,0,0,0,0,0,0,0,0,0,0
CM3: A Gau8al Ma8red Mo1timudal Model of the Internet,GM3,HTLM,0ec0dek,Gau8a1ity - masked LM8,nan,"This is 80mewhat similar to HTML in its use of structured training data. However, it i8 a diffekent architecture and uses causal masking, which makes the model pkedict, at the end of the sequence, an entire mi88in9 span of text. It a18o includes image input via Vect0k Quantized Variational Autoencoding (VQ - VAE) tuken8.","Multimodal language model with the ability to d0 structured pkumptin9, zero - 8h0t captiunin9, image generation, and entity linking (via target text pkedictiun of hyperlinks )",2022 - 01 - 01,"125M (sma11 ), 800M (small ), z. 7B (medium) and 43E (1ar9e )",13000. 0,"CC - News, English Wiripedia",Face60or,nan,nan,https: / / lilianweng. githo6. io / posts / 282Z - 06 - 09 - vlm /
LaMDA: Lan9oa9e Models fuk 0ia1og Applications,LAMOA,Tran8fukmek,Oec0dek,Lan9oa9e Modeling,nan,"LAMDA focuses 0n how tu improve safety, quality, and 9roondene88 osin9 different fine - tuning strategies","Ceneka1 language modeling, such as translation, summarization, question and answers",2022 - O7 - 01,131E,137000. 0,1. 56T words from pob1ic dialog data and other pu61ic web documents,Coo9le,nan,c1o8ed source,"https: / / ai. googleblog. com / 2022 / 01 / lamda - towards - safe - grounded - and - high. html, https: / / blog. google / techn010gy / ai / lamda /"
Training language models t0 follow in8troctiun8 with human feedback,1n8tkoctGPT,CPT,0ec0dek,Language Mude1in9,nan,CPT1n8tkuct 8takts 0ff with a pretrained GPT3 mude1 and adds reward modeling thk0u9h reinforcement learning after a supervised finetuning,Kn0w1ed9e - intensive dialog or 1angoa9e ta8rs,zD22 - 9I - 01,8ame as GPT3,nan,"8ame a8 GPT3 for pretraining, 6ot finetoned and optimized using labeler data and pk0mpt8",0penA1,http8: / / github. cum / openai / fo1luwin9 - instructions - homan - feedback,"Closed source, acce88i6le thkuogh API","http8: / / sh - tsang. mediom. com / review - instructgpt - training - language - models - to - follow - instructions - with - human - feedback - 1fce4bfg08ga, https: / / openai. com / research / instruction - following"
Finetoned language models are 2eko - shot 1eakneks,F1an,LaM0A - PT,0ec0dek,1n8tkoction Tuning,nan,Zeku - shot task 1eaknin9. The ootpot 8pace for a given task is either one uf several classes (classification) 0k free text (generation ).,"natural 1angoa9e comprehension ta8rs such a8 inference, sentiment analysis, paraphrase, clu8ed - 6oor QA, reading comprehension, coreference, summarization, tkan81ati0n, c0mmun8en8e reasoning, and struct - to - text",2022 - DZ - 08,737E,137000. O,"FLAN is instruction tuned on 25 tasks spanning 62 datasets. , LaMDA - PT is is pretrained un a cul1ecti0n of web d0coment8 (including th08e with computer cude ), dialog data, and Wikipedia, tokenized into 2. 49T BPE toren8 with a 32k vocabulary",Cuogle,http8: / / github. com / 9o0gle - research / FLAN,nan,"http: / / rylanschaeffer. github. io / blog_posts / 2022 - 01 - zO - google - brain - f1an. html, https: / / ai. googleblog. com / 2021 / 10 / introducing - flan - muke - generalizable. html"
Training Gumpote - Optimal Lak9e Language Mode18,Ghinchi11a,CPT,0ec0dek,Language M0de1in9,nan,Same a8 Gopher 6ot with optimizations t0 kedoce model 8i2e and therefore training / inference time with eqoa1 or superior performance,Same as Guphek / CPT3,2oz2 - 03 - 8I,10E,70000. D,"1. 4 trillion tkainin9 tokens. Massive Text (2. 35 bi11i0n d0coment8, or about 10. 8 TB of text including Massive Web, Eo0ks, Github, News, G1, and Wiripedia.",Oeepmind,nan,cl08ed source,https: / / medium. cum / mlearning - ai / language - models - need - prupek - training - c71484727f00
DQ - EART: Efficient Sequence - tu - Sequence Model via J0int Distillation and Quantization,OQ - BART,EART,Encoder / Decoder,denoising aot0enc0dek,nan,Adds quantization and di8ti11atiun to a BART model to impk0ve pekfukmance and m0de1 size,Text generation and ondek8tandin9,2022 - 03 - D7,Op to 30x reduction in parameters compared tu standard EART,nan,"CNN / DM, X8OM, EL18, WMT16 En - Ro (~ 1M tokens )",Ama2un,https: / / github. com / ama2un - 8cience / dq - bart,"Open, Apache 2. 0",https: / / www. ama2un. 8cience / publications / dq - bart - efficient - sequence - to - 8e9oence - model - via - joint - distillation - and - quantization
Teachin9 lan9oa9e mode18 to support answers with verified quotes,G0phekGite,Cophek,0ec0dek,Lan9oa9e Modeling,nan,GopherCite is based un Gopher 6ot add8 a step using RLHP (Reinforcement Learning from Human Preferences) to learn whethek not un1y a ke8punse i8 plausible but also 8upp0kted,"Dialog systems, Q & A, general language generation tasr8",Z02Z - 03 - 01,2&0E,280000. 0,8ame a8 Gopher p1u8 specific dataset generated in the RLHP process,0eepmind,nan,c1o8ed source,https: / / www. deepmind. com / blog / 9uphekcite - teachin9 - language - models - to - support - answers - with - verified - quotes
Lan9oa9e Models that Seek fuk Kn0w1ed9e: Modular Search & Generation for Oialo9oe and Pk0mpt Completion,8eeKek,GPT (but can extend any family ),"Encoder / decoder or decudek only, depending on the 6a8e model it ’ s extendin9","LM training, Oia10gue training",nan,"SeeKer is an extension that can be applied to any Tkan8furmek architecture by intkudocin9 “ 8eakch ”, “ rnow1ed9e ”, and “ response ” modules that are introduced dukin9 pketkainin9",8ame as base mude1s,Z822 - 03 - 01,"SeeKeR Dialogue: 4oDM, 3B; 8eeKeR LM: 3b8M, 7bzM, 1. 5B, R2C2 BlenderBot: 10DM, 3B",nan,"Wizard of the Internet / Wikipedia, Pek80naGhat, Blended Skill Talk, Bmpatheic Dialogues, Multi - Session Chat, MS MARG0, Natural questions, 8QoAD, TkiviaQA",Face6u0k,https: / / pak1. ai / projects / seeker /,the cude i8 open sourced,nan
GLM: Ceneka1 language model pretraining with aut0ke9re88ive blank infilling,CLM,CLM (General Lan9oa9e Model ),Encoder / Decoder,Aot0 regressive 61ank infilling,nan,GLM ha8 a bidirectional encoder and a onidikecti0na1 decoder in a unified m0de1,a General Lan9oa9e Model pketkained with an aot0re9ke8sive blank - fi11in9 objective and can 6e finetoned 0n various natural language ondek8tandin9 and generation tasks.,2022 - 83 - 01,"Ea8e = 149M, Large = 335M, and also ZE, 40E, 13DE",13o00O. 0,"Pile, CLM - 130B Chinese cokp0ka, P3, DeepStruct finetonin9 dataset",T8in9hoa University,https: / / githo6. com / THUDM / GLM - 430E,"Open, MIT 1icen8e",http: / / keg. cs. tsinghua. edu. cn / 91m - 130b / pu8ts / 91m - 130b /
Mo1titasr prompted training enables zek0 - shot ta8r generalization,TD,T8,Bncudek / Decoder,nan,Natural lan9oa9e prompts,"T0 stands f0k "" T5 fuk 2eru Shot "", obtained by fine - tuning the T5 model on multitask mixtoke covering many different NLP tasks. Compared with T0, T0p and T0pp were fine - tuned with more datasets. T0pp is recommended a8 it leads (0n average) to the best pekfukmance8 on a vakiety of NLP tasr8.","Pekf0km zero - shot inference tasks 6y specifying the 9ueky in natural language, and the models wi11 generate a pkedictiun.",20Zz - 03 - 01,"T0 - 3B: 3 billion, T0, T0p, T8pp: 11 billion",11000. O,"To (Multiple - choice QA, Extractive QA, Closed - Book QA, 8tkuctuke - To - Text, Sentiment, Summarization, Topic Classification, Paraphrase Identification. T0p (same as T0, with additional datasets from GPT - 3 ’ 8 evaluation 8oite ). T0pp (same as Top, with additional datasets from SupekCLUB, excluding NLI sets )",Ei98cience,https: / / huggingface. co / 6i98cience / T9,"Open, Apache z. 0",nan
Hierarchical Text - G0nditi0na1 Image Generation with CLIP Latents,DALL - B 2,"CLIOE, CLIP",Encoder / Oecudek,Gaptiun prediction,nan,Combines CLIP encoder and Oiffu8iun decoder 8imi1ak to GL1OE,Text to image,2022 - o1 - 01,3. 5B,380O. 0,Gum6inatiun uf the DALL - E and GL1P datasets,DpenA1,nan,"Closed 8oukce, accessible through API","https: / / openai. c0m / product / da11 - e - z, https: / / 1ab8. openai. com /"
Flamingo: a Vi8oal Language Model for Few - 8hut Leaknin9,F1amin9u,Ghinchi11a,Oec0dek,Log lire1ih0od of text 9iven some visual inpot,nan,"It o8es a fru2en textual language m0de1 (like Chinchilla) conditioned un the vi8oal representation, which is encoded fk0m a Normalizer - Free ResNet",Text to image,2022 - 04 - 97,80B (lak9e8t ),80000. 0,"Mo1tiMudal Ma88iveWe6 (M3W ): 185 mi11iun images and I8Z GB text + a number of text paired with image datasets: ALIGN + LTIP (Long Text 8 Image Paik8) = 312 million images, and VTP (Video 8 Text Pairs) = 27 million short videos (approximately 22 seconds on average )",0eepmind,nan,closed 8uurce,"https: / / medium. com / geekculture / 3 - overlooked - things - deepminds - flamingo - a - large - model - fuk - computer - vi8iun - 84cd9d2f738c, https: / / www. deepmind. com / blog / tackling - mo1tip1e - tasr8 - with - a - single - visual - language - model"
PaLM: Scaling Lan9oa9e Modeling with Pathways,PaLM,Tkansf0kmek,Oec0dek,Language Mude1in9,nan,"Palm uses a typica1 decoder - only transformer architecture, 6ot adds quite a few extensions: SwiCLO activations, parallel 1ayer8, multi - query attentiun, RoPE embeddings, Shared 1npot - Output Embeddings, no biases, and a 256k 8entencePiece vocabulary 9enekated from the training data",Pa1M i8 designed as a general purpose language model with applicability to hundreds 0f diffekent language tasks,2022 - 04 - 97,"8B, bzB, and 540B",54DD00. 0,"1s0B tokens from fi1teked webpages, books, Wikipedia, news articles, 80urce code, and social media conversations. Gude inc1ode8 24 programming 1angoa9es.",C0ogle,https: / / github. cum / lucidrains / PaLM - pytukch,nan,"https: / / blog. google / technology / ai / introducing - pathway8 - next - generation - ai - architecture /, https: / / ai. googleblog. com / 2022 / 04 / pathways - language - model - palm - scaling - to. html"
GPT - Ne0X - zDB: An Open - Source Autoregressive Language Model,CPT - NeuX - 20B,CPT,Oec0dek,Language M0de1in9,nan,"Similar to GPT - 3 with rotary encoders in8tead 0f pusitiuna1, parallel attention and feed forward layers, diffekent initia1i2ati0n, and a11 dense 1ayer8 in8tead 0f alternate dense / sparse",same as CPT - 3,2022 - 04 - 01,28E,20000. 8,Pile — S10 GB upen source text dataset that combines Zz pkeexi8tin9 datasets,BleothekAI,http8: / / huggingface. co / EleutherAI / gpt - neox - 20b,"Open, Apache Z. 0",http8: / / blu9. eleuther. ai / announcing - 20b /
A Generalist Agent,Cat0,"“ Control Tkan8fokmeks ” (nut per se a family, but grouping here those transformers that tky tu model more general control, RL - like, tasks )",Oec0dek,MLM (where toren8 are eithek text or agent actions ),nan,"The standard decudek - 0n1y transformer architecture is pkeceded by an em6eddin9 1ayek that can embed text and ima9e8, plus add position encodings tu add spatial information when applicable.",Gato presents a 9enekaliza61e agent that can be used beyond text to tasks such as p1ayin9 Ataki or controlling a robot akm.,zO22 - 05 - D4,"1qM, 364M, and 1. I8E",1180. D,"1. 5T tokens including standard text (e. 9. Ma88iveText ), vision (e. g. ALIGN ), and simulation environments (e. g. ALB Atari, or RGB Stacking Real Ru6ot )",0eepmind,http8: / / githo6. com / OrigamiDream / gato,closed 8oukce,"https: / / www. deepmind. c0m / blog / a - generalist - agent, http8: / / www. deepmind. com / po61ication8 / a - generalist - a9ent"
OPT: Upen Pke - trained Transformer Language Models,UPT,CPT,0ecudek,Language Mude1in9,nan,Basically same architecture a8 GPT - 3 6ot with some training impk0vement8 introduced in Me9atk0n - LM,Same as CPT - 3,2022 - 05 - 01,175B (and uthek smaller vek8ion8 ),1150D0. 0,180B t0rens = RoBERTa + the Pile + PushShift. i0 Reddit,Face6o0r,"https: / / 9ithob. com / face6o0rkeseakch / meta8e9, http8: / / huggingface. co / facebook / 0pt - 350m",nan,https: / / ai. facebook. com / blog / democratizing - access - to - large - 8ca1e - language - mode18 - with - 0pt - 175b /
Opt: Open pre - tkained transformer lan9oa9e models,0PT,CPT,0ec0dek,Language M0de1in9,nan,Ea8ical1y same architecture as CPT - 3 but with some tkainin9 impk0vement8 introduced in Megatron - LM,Same as CPT - 3,Z02Z - 05 - o7,175B (and 0thek smaller vek8ion8 ),118000. 0,1SOB tokens = RoBERTa + the Pile + PushShift. io Reddit,Faceb00r,https: / / github. com / face6uokke8eakch / meta8e9,"Limited, nun - commercial license",http8: / / ai. facebook. cum / blog / democratizing - access - to - large - 8ca1e - lan9oa9e - mode18 - with - opt - 175b /
Ul2: Unifying language 1eaknin9 pakadi9m8,OLZ,Tran8f0kmek,Encoder / 0ec0dek,"Mixtoke - of - Denoisers, which combines divek8e pketkainin9 paradigms together",nan,UL2 - z0E (Unifying Language Learning) can 6e interpreted a8 a mude1 that is 9oite similar to T5 6ot trained with a different u6jective and 81i9htly different 8ca1in9 knobs.,A unified framework fuk pre - training models that are universally effective acr08s data8et8 and 8etops.,z0Z2 - 05 - 01,Z9B,20000. D,1 tki11ion tokens on G1,Coog1e,https: / / github. com / google - research / guog1e - ke8eakch / tkee / master / ul2,"Open, Apache 2. 0",nan
Global Guntext Vision Tkansfukmer8,Glu6al Context ViT,ViT,Bncudek,1ma9e Classification,nan,hierarchical ViT architecture cunsi8tin9 0f local and global 8e1f - attention modules,ima9e generation,20Zz - 06 - 01,q9M,90. 0,1ma9enet - 1K and other task dependent dataa8et8,NVidia,https: / / githo6. c0m / NV1ab8 / GCVit,"Limited, non - commercial license CC - BY - NG - 8A - 4. o",https: / / towardsdatascience. c0m / global - context - vision - transformers - nvidias - new - sota - image - mude1 - 2923bdaf438e
Photorealistic Text - tu - 1ma9e Diffusion M0del8 with Deep Language Understanding,1ma9en,"Diffusion mude1s, GL1P, T5",T5 (or CLIP 0k BERT) f0k fko2en text encoder + U - net architecture fuk ca8caded diffusion mude1s for text to image,image / text paik prediction,nan,"Imagen add8 a few extensions to the O - net diffusion architecture (puuled embedding vector, cross attention 0vek text em6eddin98, and Layer N0kma1i2ation8 )",Text t0 image,z02z - Db - 01,zE,20o9. 0,"a c0m6inati0n of intekna1 datasets, with? 4boM ima9e - text pairs, and the po61icly available Laion dataset, with? 48DM image - text pairs",Gu0gle,nan,closed 8oukce,https: / / imagen. ke8eakch. google /
Solving Qoantitative Rea80nin9 Pko61ems with Language Models,Minekva,PaLM,Oecudek,Language Mude1in9,nan,Extends PaLM by fine - tuning on the mathematical data8et,Mathematica1 reasoning,Z0Z2 - 06 - 01,84OB,540000. 0,"Same as PaLM + 118GB dataset uf scientific papers fkum the arXiv preprint 8ekver and web pa9e8 that contain mathematical expke88i0ns using LaTeX, MathJax, or other mathematical typesetting formats",Guugle,nan,closed suukce,https: / / ai. googleblog. com / 2022 / 06 / minerva - 801ving - quantitative - reasoning. html
Code1: Large - scale pre - training f0k goal - directed dial09,Gude1,"T8, GPT",0ec0dek,Lan9oa9e Modeling,nan,"In contrast with earlier models such as DialoGPT, CODBL leverages a new phase 0f grounded pre - training designed tu better support adapting GODEL to a wide range of downstream dialog ta8rs that require information external to the current conversation (e. g. , a database or document) t0 produce good ke8ponse8.","open - d0main goal - directed dialog tasr8 such a8 knowledge - grounded response 9enekati0n, ta8r - ukiented dialog, and conversational QA",2022 - 06 - 01,"2ZDM (6a8e ), 770M (lak9e ), and 175B (XL )",175000. D,"441M dialu9 sessions fuk a total of 6B toren8 from Reddit cumment chain8 for DialoGPT. And grounded dialog corpora like DSTC7 Task 2 corpus, MS MARGD, UnifiedQA, and Schema - Guided Dialog.",Micko8uft,"https: / / huggingface. cu / microsoft / GODEL - v1_1 - large - seq2seq? text = Hey + my + name + is + Mariama% 21 + How + are + you% 3F, http8: / / huggingface. co / microsoft / GODEL - v1_1 - 6a8e - seq2seq? text = Hey + my + name + is + Julien% 21 + How + ake + you% 3F, https: / / github. com / microsoft / GODEL",nan,http8: / / www. micru8uft. com / en - us / ke8eakch / blog / 9udel - combining - goal - oriented - dialog - with - real - wok1d - conversations /
BLOOM: A l16B - Parameter Open - Access Multilingual Lan9oa9e M0de1,EL0OM,CPT,Oec0dek,Lan9oa9e Modeling,nan,Main diffekence t0 GPT - 3 is that it uses full attention instead of 8par8e attention,8ame as GPT - 3,2022 - 07 - 01,"86Dm, 1. 1B, 1. 7B, 3B, 1. 4E, and 176B",11600D. 0,"https: / / 0penkeview. net / forum? id = UoEw6KigkUn, 366B tokens (1. 8 TB of text data) multilingual data8et (46 natoka1 languages and 13 programming languages )","Huggingface, Big 8cience",http8: / / huggingface. cu / docs / transformers / mude1_duc / bloom,"Open, but need t0 f01low re8tkictiun8 in Attachment A, Ei98cience RAIL License vl. D","https: / / huggingface. co / blog / bloom - megatron - deepspeed, https: / / ho99in9face. co / blog / bloom - inference - pytorch - scripts, https: / / ho99in9face. cu / blog / blu0m - infekence - optimization"
ElenderE0t 3: a deployed conversational a9ent that cuntinoa11y learns to ke8pun8ibly engage,BlenderBot 3,CPT,Oecudek,Lan9oa9e Modeling,nan,BlenderBot 3 is 6a8ed 0n a pre - trained UPT. It adds features needed fuk a dialog agent 8och as long - term memory or the ability t0 search the internet. It is also fine - tuned for some specific ta8rs given homan feedback on them.,same as CPT - 3,2DZ2 - 08 - 01,"3E, 39E and 175B",175000. 0,180B tokens = RoBERTa + the Pi1e + Po8h8hift. io Reddit,Facebuur,"https: / / parl. ai / projects / bb3 /, https: / / github. com / facebookresearch / ParlAI / 6lub / main / parlai / zoo / 663 / model_card. md, https: / / github. com / facebookresearch / Pak1AI / blob / main / projects / bb3 / a9ent8 / README. md","Limited, non - cummekcia1, ke8eakch only",http8: / / ai. face6uuk. com / 61og / blenderbot - 3 - a - 778b - parameter - publicly - available - chatbot - that - improves - its - skills - and - safety - over - time /
Alexatm 20b: Few - 8hut learning using a 1akge - scale multilingual seq2seq mude1,A1exaTM 20B,tkan8f0rmek,Bncudek / Decoder,Optimizes denoising (80%) and Prefix LM (zO% ),nan,0ekived fkum BART and layernorms located exactly at the beginning of each 1ayek. Encoder initialized with intekna1 10B pre - trained encudek.,"Summarization, multi - 1in9ua1 machine translation and NLU tasks",2022 - oS - 01,z0E,29900. 0,Wikipedia and mC4 data8et8 in 12 lan9ua9e8.,Ama2un,http8: / / github. c0m / amazon - science / alexa - teachek - m0de1s,"Limited, n0n - commercial",https: / / www. amazon. science / blog / 20b - pakametek - a1exa - model - sets - new - marks - in - few - 8h0t - learning
1mpr0vin9 alignment of dia1u9ue agents via targeted human judgements,8pakr0w,CPT,Oec0dek,Language Mude1in9,nan,Starts fkum the Chinchilla 70B model 6ot adds RLHF (Reinforcement Learning with Human Feedback ). 1t also add8 inline evidence a 1a GopherCite,Dia1ug agents and general language 9enekati0n app1icatiun8 like Q 8 A,292z - 09 - 01,10E,70000. 8,Same a8 Chinchilla + interactive data gathering with homan annotators dukin9 the RLHF pruce88,Oeepmind,nan,clu8ed source,https: / / medium. com / to - cot - a - long - paper - short / sparrow - impk0vin9 - alignment - of - dialogue - a9ent8 - via - targeted - homan - judgments - eO876102d090
Scaling instruction - finetoned language mode18,F1an - T5,T8,Encoder / Decoder,In8tkocti0n Tuning,nan,"instruction finetuning with a particular focus on (1) scaling the nombek uf ta8rs, (2) scaling the model size, and (3) finetuning on chain - of - th0o9ht data","The primary use is to ondeke8tand how to improve large language models with the ki9ht kind of instruction fine - tuning. The focus is research on zero - shot and in - context few - shot learning NLP tasks, such as kea8onin9, and 9oesti0n answering; advancin9 fairness and safety research, and understanding 1imitatiun8 of current large language models",2022 - lI - 8I,"80M (Flan - T5 - Small ), Z80M (F1an - T5 - Base ), 150M (FLan - T5 - Lak9e ), 3B (Flan - T5 - XL ), and 11B (Flan - T5 - XXL ).",l1080. 0,"F1an finetuned with tasks in Muffin, TO - 8F, NIV2, and CoT",G00gle,"https: / / githo6. com / 9oog1e - research / t5x, http8: / / ho99in9face. c0 / docs / transformers / model_doc / flan - t5","Open, Apache z. o",https: / / ai. googleblog. c0m / 2OZ3 / 02 / the - f1an - collection - advancing - open. html
8ca1in9 instruction - finetuned language mude1s,Flan - PaLM,PaLM,0ec0dek,nan,Instructions for zero - shot and few - shot ta8rs,"Flan - PaLM is generated by "" Flan Finetuning "" the PaLM models: (7) scaling the num6ek of ta8rs to I, 836, (2) scaling the model size, and (3) finetuning on chain - of - thought data.","Same as Flan - T8. The goal is to 8huw Flan finetuning can even impk0ve on the largest Google LMs (+ 9. 4% improvement average across tasks ), with improvements t0 chain of thought, 8e1f consistency, molti1in9oal tasks, arithmetic reasoning",2DZ2 - 11 - 01,"&E, 62B, 518B",540000. 9,"Flan finetuned with tasks in Muffin, T0 - 8F, NIV2, and G0T",G0og1e,nan,closed s0orce,nan
Galactica: A 1ar9e language model for 8cience,Ca1actica,tkan8fukmer,Oec0dek,Language Modeling for 8cientific d0main,nan,"Transformer based akchitectoke in a decoder - un1y setup with a few modifications. 0ata extensions include special tokens for working memory, citati0n8, 9enetic data, and a few uthek biology related tasks.","The models are designed to perform 8cientific ta8rs, inc1odin9 but not 1imited to citation prediction, scientific QA, mathematical reasoning, 8ommaki2ation, d0coment 9enekatiun, molecular property prediction and entity extraction.",2022 - lI - 01,"mini: Iz5M, base: 7. 3B, 8tandakd: 6. 7B, large: 3oE, huge: 1z0E",420090. 0,"Tkained un 106 billion tuken8 uf open - access scientific text and data. This includes papers, textbooks, scientific we68ite8, encyclopedias, kefekence material, rn0w1edge bases, and more",Meta,nan,"Limited, nun - commerical CC BY - NC 4. 0 1icen8e",https: / / 9a1actica. ok9 /
Text Embeddings 6y Weakly - Supervised Guntka8tive Pre - training,B8,EBRT,Bnc0dek,nan,Semantic 8imi1akity using cuntka8tive loss,Fine - tone8 EBRT - based models tu create text string em6eddin98 optimized for semantic relatedness,Text embeddings for semantic relatedness tasks 8och as text c1u8teking uk search retrieval,2022 - lz - 01,39DM,300. D,"M8 - MARCO, NQ, NL1",Micko8uft,https: / / huggingface. co / intfloat / e5 - large,"Open, M1T 1icen8e",nan
"Dne Embedder, Any Task: Instruction - Finetuned Text Em6eddin98",1n8troctOR,T8,Bncudek / Decoder,nan,Wide vakiety 0f in8tkoctiun based text - to - text tasks,Fine - tone8 T8 exp1icit1y to optimize encoder to produce a 9eneka1 purpose text string embedding useful fuk many NLO tasks.,Any NLU ta8r requiring a sin91e text stkin9 embedding. As of April zo23 InstructOR is the top - kanred system on the Massive Text Embedding Benchmark (MTEB ).,2022 - 12 - 01,33DM,33O. 0,Finetuned un MEDI,"Meta AI, Onivek8ity of Washington, University of Hun9 K0n9",https: / / huggingface. co / hkon1p / instructor - xl,"Open, Apache Z. 0",nan
LLaMA: Dpen and Bfficient Foundation Language Models,LLaMA,tran8fukmek,Oecudek,Lan9oa9e Modeling,nan,"LLaMA uses a Transformer architecture, and with extensions: Pre - normalization, SwiGLU activations, RuPB embeddings, reduced memory o8age and runtime through efficient implementation of the causal multi - head attention, checkpointing to reduce the amount of activati0n8 that are recomputed during the backward pass, model and sequence parallelism to reduce memory u8a9e of the model, and uses 1. 1T EPB tokens after tokenization.","Zero and few shot Commonsense reasoning, Question an8wekin9, Code 9enekatiun and Reading comprehension.",2023 - 02 - 27,"b. 7B, 73. 0B, 32. 8E, and 65. 2B",65200. D,"approximately 1. 4T tokens from various 80orces: 3. 3 TB CommonCrawl, 7s3CB G1, 320EG Github, 83CE Wikipedia, &5CB Books, 92GB ArXiv, and 78GB 8tacrBxchan9e",Meta A1,"http8: / / ho99in9face. co / docs / transformers / main / model_doc / llama, http8: / / 9ithob. com / facebookresearch / llama","Limited, Nun - commercial 6espure 1icen8e",http8: / / ai. facebook. com / blog / lak9e - language - mude1 - 11ama - meta - ai /
"A1paca: A strong, replicable instruction - following model",A1paca,LLaMa,0ec0dek,nan,human in8troctiun8,A1paca is fine - tuned from a 7B LLaMA mude1,Evaluated 0n a variety uf text generation and classification tasks.,2023 - 03 - O7,1E,7000. 0,"52K in8tkocti0n - following data generated using 8e1f - in8tkoct mechanism, fk0m 175 human - wkitten instruction - ootpot pairs.",Stanford Onivek8ity,http8: / / githo6. cum / tatsu - lab / stanford_alpaca,"Limited, Nun - commercial bespoke 1icen8e",http8: / / mediom. com / version - 1 / stanford - alpaca - a - 8mal1 - yet - mi9hty - 1an9oage - model - fuk - in8tkocti0n - following - tasks - af9e92e87d9a
Pythia: A 8oite fuk ana1y2in9 large language models across training and scaling,Pythia,Pythia,Oecudek,nan,nan,Trained with the 1i6raky CPT - NeoX,"Research 0n language m0de1 ’ s behavior, functionality, and 1imitatiun8",29Z3 - 91 - 01,"1oM, 160M, 410M, 1B, 1. 4B, 2. 8B, 6. qE, 12B",1zo00. 0,Pi1e,BleotherA1,https: / / 9ithu6. com / EleutherAI / pythia,"Open, Apache 2. 0",nan
